Title,Price,Brand,Model,Cabinet Type,Link
NZXT H510 - CA-H510B-B1 - Compact ATX Mid-Tower PC Gaming Case - Front I/O USB Type-C Port - Tempered Glass Side Panel - Cable Management System - Water-Cooling,69.99,NZXT,H510B-B1,ATX Full Tower,https://amazon.com/dp/B07TD9C5HS?tag=pcbuilder00-20
Thermaltake Ceres 300 TG ARGB Snow E-ATX Motherboard Air Flow Oriented Middle Tower PC Case CA-1Y2-00M6WN-00 CS8725,94.62,Thermaltake,CA-1Y2-00M6WN-00,ATX Full Tower,https://amazon.com/dp/B0C39ZYZ9V?tag=pcbuilder00-20
Fractal Design Pop XL Silent Black Tempered Glass Clear Tint,103.33,Fractal Design,FD-C-POS1X-02,ATX Full Tower,https://amazon.com/dp/B08KTM7F6Y?tag=pcbuilder00-20
Fractal Design Pop XL Silent Black Solid,103.33,Fractal Design,FD-C-POS1X-01,ATX Full Tower,https://amazon.com/dp/B08KTMSQSZ?tag=pcbuilder00-20
"Antec Performance 1 FT, Full Tower, RTX40 Fully Compatible, Temp Display, 4 x Storm T3 PWM Fans, Type-C, Dual TG Side Panels, Removable Top Bracket, High Airflow Mesh Front Panel, E-ATX PC Gaming Case",107.91,Antec,0-761345-10088-5,ATX Full Tower,https://amazon.com/dp/B0BTRYDX4K?tag=pcbuilder00-20
P120CRYSTAL WHITE,110.99,Antec,0-761345-81201-6,ATX Full Tower,https://amazon.com/dp/B08VH6VSG7?tag=pcbuilder00-20
"Cougar MX600 RGB Full Tower PC Case with 4 x ARGB PWM Fans, 5 x strategically Placed Filters, The Premium Cable Management Features, 400mm GPU Capacity, 2 x USB-A and 1 x USB-C Ports (Black)",119.99,COUGAR,3857C90.0001,ATX Full Tower,https://amazon.com/dp/B0CLD3T5SH?tag=pcbuilder00-20
"Cougar MX600 RGB Full Tower PC Case with 4 x ARGB PWM Fans, 5 x strategically Placed Filters, The Premium Cable Management Features, 400mm GPU Capacity, 2 x USB-A and 1 x USB-C Ports (White)",119.99,COUGAR,3857C90.0002,ATX Full Tower,https://amazon.com/dp/B0CLD481Z9?tag=pcbuilder00-20
Thermaltake CTE C750 TG ARGB E-ATX Full Tower with Centralized Thermal Efficiency Design; 3x140mm CT140 ARGB Fans Pre-Installed; Tempered Glass Front & Side Panel; CA-1X6-00F1WN-01; Black,125.09,Thermaltake,CA-1X6-00F1WN-01,ATX Full Tower,https://amazon.com/dp/B0C57PGT8R?tag=pcbuilder00-20
Fractal Design Pop XL Air RGB Black Tempered Glass Clear Tint,128.22,Fractal Design,FD-C-POR1X-06,ATX Full Tower,https://amazon.com/dp/B08T1VC921?tag=pcbuilder00-20
Fractal Design Pop XL Air RGB White Core Tempered Glass Clear Tint,128.22,Fractal Design,FD-C-POR1X-01,ATX Full Tower,https://amazon.com/dp/B08KTMWY5H?tag=pcbuilder00-20
"MagniumGear (MG-NE620Q_DBK02) NEO Qube 2, Dual Chamber ATX Mid-Tower, Digital-RGB Lighting, Front I/O USB Type C",129.99,MagniumGear,MG-NE620Q_DBK02,ATX Full Tower,https://amazon.com/dp/B07YFQ1TSL?tag=pcbuilder00-20
Fractal Design Meshify 2 Compact Black ATX Flexible High-Airflow Dark Tinted Tempered Glass Window Mid Tower Computer Case,131.99,Fractal Design,Meshify 2 Compact TG Dark Tint,ATX Full Tower,https://amazon.com/dp/B08X7BJZG1?tag=pcbuilder00-20
Thermaltake CTE C750 Air Snow E-ATX Full Tower with Centralized Thermal Efficiency Design; 3x140mm White CT140 Fans Pre-Installed; Tempered Glass Side Panel; Mesh Front Panel; CA-1X6-00F6WN-00; White,138.28,Thermaltake,CA-1X6-00F6WN-00,ATX Full Tower,https://amazon.com/dp/B0C57Q2D5V?tag=pcbuilder00-20
Phanteks Enthoo Pro Full Tower Chassis without Window Cases,139.99,Phanteks,Enthoo Pro,ATX Full Tower,https://amazon.com/dp/B00KFAG6DA?tag=pcbuilder00-20
Phanteks Enthoo Pro Full Tower Chassis with Window Cases,145.99,Phanteks,Enthoo Pro,ATX Full Tower,https://amazon.com/dp/B00K6S1B3Q?tag=pcbuilder00-20
Phanteks Enthoo Pro Tempered Glass,149.99,Phanteks,Enthoo Pro,ATX Full Tower,https://amazon.com/dp/B078K32G27?tag=pcbuilder00-20
"Phanteks (PH-ES620PC_BK02) Enthoo Pro 2 Server Edition ??SSI-EEB Motherboard Support, 11-PCI Slots, 15x Fan Positions (Closed Panel)",151.11,Phanteks,PH-ES620PC_BK02,ATX Full Tower,https://amazon.com/dp/B0CBPL895B?tag=pcbuilder00-20
Thermaltake CTE C750 TG ARGB Snow E-ATX Full Tower with Centralized Thermal Efficiency Design; 3x140mm White CT140 ARGB Fans Pre-Installed; Tempered Glass Front & Side Panel; CA-1X6-00F6WN-01; White,153.65,Thermaltake,CA-1X6-00F6WN-01,ATX Full Tower,https://amazon.com/dp/B0C57QYSB2?tag=pcbuilder00-20
Thermaltake CTE C750 Air E-ATX Full Tower with Centralized Thermal Efficiency Design; 3x140mm CT140 Fans Pre-Installed; Tempered Glass Side Panel; Mesh Front Panel; CA-1X6-00F1WN-00; Black,155.09,Thermaltake,CA-1X6-00F1WN-00,ATX Full Tower,https://amazon.com/dp/B0C57RVDZQ?tag=pcbuilder00-20
Thermaltake Core X71 Tempered Glass Edition SPCC ATX Full Tower Tt LCS Certified Gaming Computer Case with 2 140 Blue Front Fan,157.99,Thermaltake,Core X71,ATX Full Tower,https://amazon.com/dp/B01N4R021Q?tag=pcbuilder00-20
"Phanteks (PH-ES620PTG_BK02) Enthoo Pro 2 Server Edition ??SSI-EEB Motherboard Support, 11-PCI Slots, 15x Fan Positions (Tempered Glass)",159.05,Phanteks,PH-ES620PTG_BK02,ATX Full Tower,https://amazon.com/dp/B0CBPM8492?tag=pcbuilder00-20
Cougar Panzer Max Ultimate Full Tower Gaming Case,161,COUGAR,Panzer Max,ATX Full Tower,https://amazon.com/dp/B01HQHQF1W?tag=pcbuilder00-20
Cougar Panzer Max-G Full Tower Gaming Case with a Full-Sized Tempered Glass Panel,164,Cougar,Panzer Max-G,ATX Full Tower,https://amazon.com/dp/B07YN2H66T?tag=pcbuilder00-20
ASUS TUF Gaming GT501 ZENITSU Mid-Tower Computer Case for up to EATX Motherboards,171.76,ASUS,GT501 TUF GAMING CASE/YEL/HANDLE,ATX Full Tower,https://amazon.com/dp/B0B7VSQ1PB?tag=pcbuilder00-20
Thermaltake Core V71 Tempered Glass Edition E-ATX Full Tower Tt LCS Certified Gaming Computer Case,174.99,Thermaltake,Core V71,ATX Full Tower,https://amazon.com/dp/B074ZLQZ8F?tag=pcbuilder00-20
LIAN LI PC-O11 Dynamic Razer Edition Black Tempered Glass ATX Mid Tower Gaming Computer Case,179.99,Lian Li,PC-O11D Razer,ATX Full Tower,https://amazon.com/dp/B07P96XQNJ?tag=pcbuilder00-20
RAIJINTEK 0r200050 Case for PC Silver,180.63,Raijintek,0R200050,ATX Full Tower,https://amazon.com/dp/B0794N1XVL?tag=pcbuilder00-20
Lian Li pc-o11dx Black for PC Case,185.99,Lian Li,PC-O11 Dynamic,ATX Full Tower,https://amazon.com/dp/B07C88X1VV?tag=pcbuilder00-20
Corsair Graphite Series 780T Full Tower PC Case,189.74,Corsair,Graphite 780T,ATX Full Tower,https://amazon.com/dp/B00LA6ZLGQ?tag=pcbuilder00-20
"Phanteks (PH-ES620PTG-DBK01) Enthoo Pro 2 Full Tower ??High-Performance Fabric mesh, Tempered Glass",189.99,Phanteks,PH-ES620PTG_DBK01,ATX Full Tower,https://amazon.com/dp/B0894J31QS?tag=pcbuilder00-20
Thermaltake View 51 Snow Motherboard Sync Full Tower Gaming Computer Case with 2 200mm ARGB 5V Motherboard Sync RGB Fans + 140mm Black Rear Fan Pre-Installed,205.99,Thermaltake,View 51,ATX Full Tower,https://amazon.com/dp/B08451HJGG?tag=pcbuilder00-20
"be quiet! Dark Base 900 Orange, Full Tower ATX, 3 Pre-Installed Silent Wings 3 Fans",214.9,be quiet!,Dark Base 900,ATX Full Tower,https://amazon.com/dp/B01H6JO9HW?tag=pcbuilder00-20
Fractal Design Meshify 2 XL Black ATX Flexible Dark Tinted Tempered Glass Window Full Tower Computer Case,216.95,Fractal Design,Meshify 2,ATX Full Tower,https://amazon.com/dp/B082318ZCB?tag=pcbuilder00-20
Thermaltake View 71 RGB 4-Sided Tempered Glass Vertical GPU Modular E-ATX Gaming Full Tower Computer Case,219.99,Thermaltake,View 71 TG RGB,ATX Full Tower,https://amazon.com/dp/B074ZN21M8?tag=pcbuilder00-20
Thermaltake View 71 Snow 4-Sided Tempered Glass Vertical GPU Modular SPCC E-ATX Gaming Full Tower Computer Case Chassis 3-Way Radiator View with 2 White LED Riing Fan Pre-Installed CA-1I7-00F6WN-00,219.99,Thermaltake,CA-1I7-00F6WN-00,ATX Full Tower,https://amazon.com/dp/B07D9CKZV8?tag=pcbuilder00-20
Thermaltake Level 20 GT E-ATX Full Tower Vertical GPU Modular Gaming Computer Case Tempered Glass,219.99,Thermaltake,Level 20 GT,ATX Full Tower,https://amazon.com/dp/B07FDDJJ4X?tag=pcbuilder00-20
"Phanteks (PH-NV723TG_DMW01) NV7 Showcase Full-Tower Chassis, High Airflow Performance, Integrated D/A-RGB Lighting, Seamless Tempered Glass Design",219.99,Phanteks,PH-NV723TG_DMW01,ATX Full Tower,https://amazon.com/dp/B0BYQSBYYS?tag=pcbuilder00-20
Fractal Design Meshify 2 XL Black ATX Flexible Light Tinted Tempered Glass Window Full Tower Computer Case,225,Fractal Design,Meshify 2 XL,ATX Full Tower,https://amazon.com/dp/B08232YMV9?tag=pcbuilder00-20
Lian Li pc-o11dw Case for PC White,225.82,Lian Li,PC-O11 Dynamic,ATX Full Tower,https://amazon.com/dp/B07C88K4KP?tag=pcbuilder00-20
Fractal Design Define 7 XL Black Brushed Aluminum/Steel E-ATX Silent Modular Full Tower Computer Case,228,Fractal Design,Define 7 XL,ATX Full Tower,https://amazon.com/dp/B08146GB6Y?tag=pcbuilder00-20
"Phanteks Enthoo 719 High Performance Full Tower Case ??Tempered Glass, Aluminum Panels, Dual System/PSU Support, Massive Storage, Fan Hub, Digital-RGB Lighting",229.99,Phanteks,Enthoo 719,ATX Full Tower,https://amazon.com/dp/B07TVFHTDW?tag=pcbuilder00-20
"Phanteks Enthoo 719 High Performance Full Tower Case ??Tempered Glass, Aluminum Panels, Dual System/PSU Support",229.99,Phanteks,Enthoo 719,ATX Full Tower,https://amazon.com/dp/B07TTDW37B?tag=pcbuilder00-20
Thermaltake Level 20 HT Snow Edition 4 Tempered Glass Type-C Fully Modular E-ATX Full Tower Computer Chassis with 2 140mm Top Fan Pre-Installed,229.99,Thermaltake,Level 20 HT,ATX Full Tower,https://amazon.com/dp/B07ZLFNGF6?tag=pcbuilder00-20
Thermaltake View 71 4-Sided Tempered Glass Vertical GPU Modular SPCC E-ATX Gaming Full Tower Computer Case with 2 Blue LED,238.33,Thermaltake,View 71 4,ATX Full Tower,https://amazon.com/dp/B074ZL25BP?tag=pcbuilder00-20
Silverstone Extended-ATX Tek Aluminum Full Tower Computer Case,239.99,SilverStone Technology,FT04B-W,ATX Full Tower,https://amazon.com/dp/B00DU6RWIE?tag=pcbuilder00-20
"Phanteks Full Tower ??High-Performance Fabric mesh, Closed Window, Dual System/PSU Support, Massive Storage",243.45,Phanteks,Enthoo Pro 2,ATX Full Tower,https://amazon.com/dp/B0894H2JZ4?tag=pcbuilder00-20
"Phanteks (PH-NV723TG_DBK01) NV7 Showcase Full-Tower Chassis, High Airflow Performance, Integrated D/A-RGB Lighting, Seamless Tempered Glass Design, 12 Fan Positions, Black",244.76,Phanteks,PH-NV723TG_DBK01,ATX Full Tower,https://amazon.com/dp/B0BYQXVG4M?tag=pcbuilder00-20
Lian Li O11 Dynamic XL ROG Certified ATX Full Tower Gaming Computer Case,249.74,Lian Li,Dynamic XL ROG,ATX Full Tower,https://amazon.com/dp/B07R4C2YQS?tag=pcbuilder00-20
"Asus ROG Strix Helios Mid-Tower Computer Case for up to EATX Motherboards with USB 3.1 Front Panel, Smoked Tempered Glass, Brushed Aluminum and Steel Construction, and Four Case Fans",249.99,ASUS,ROG Strix Helios,ATX Full Tower,https://amazon.com/dp/B07T28NZZ3?tag=pcbuilder00-20
Thermaltake View 51 Motherboard Sync ARGB E-ATX Full Tower Gaming Computer Case with 2 200mm ARGB 5V Motherboard Sync RGB Fans + 140mm,252.02,Thermaltake,View 51,ATX Full Tower,https://amazon.com/dp/B08451HFPR?tag=pcbuilder00-20
Cougar Panzer EVO RGB Black ATX Full Tower RGB LED Gaming Case with Remote,254.28,COUGAR,Panzer EVO,ATX Full Tower,https://amazon.com/dp/B07F13WPCB?tag=pcbuilder00-20
"Cooler Master MasterFrame 700 Customizable Open-air Frame PC Case, Convert Between a Showcase PC Chassis or a Highly Flexible Test Bench",254.41,Cooler Master,MasterFrame 700,ATX Full Tower,https://amazon.com/dp/B08S6XZ219?tag=pcbuilder00-20
Lian Li O11 Dynamic XL ROG Certified (Black) ATX Full Tower Gaming Computer Case,255.92,Lian Li,O11D XL-X,ATX Full Tower,https://amazon.com/dp/B07R7DXCCH?tag=pcbuilder00-20
Fractal Design Define 7 XL E-ATX Silent Modular Tempered Glass Window Full Tower Computer Case,256,Fractal Design,Define 7 XL,ATX Full Tower,https://amazon.com/dp/B08146HTV5?tag=pcbuilder00-20
Lian Li O11 Dynamic XL ROG Certified (Silver) ATX Full Tower Gaming Computer Case,258,Lian Li,O11D XL-A,ATX Full Tower,https://amazon.com/dp/B07ZJZKXGM?tag=pcbuilder00-20
"Lian Li Odyssey X Silver Tempered Glass on The Left and Right Sides, Aluminum Full Tower Gaming Computer Case - TR-01A",259,Lian Li,Odyssey X Silver,ATX Full Tower,https://amazon.com/dp/B0995S2QRM?tag=pcbuilder00-20
Thermaltake Tower 900 Black Edition Tempered Glass Fully Modular E-ATX Vertical Super Tower Computer Chassis,264.99,Thermaltake,Tower 900,ATX Full Tower,https://amazon.com/dp/B01N1GP2GZ?tag=pcbuilder00-20
Rosewill Gaming ATX Full Tower Computer Case Cases Thor V2,266,Rosewill,THOR V2,ATX Full Tower,https://amazon.com/dp/B0058P5S9A?tag=pcbuilder00-20
"CORSAIR 7000D AIRFLOW Full-Tower ATX PC Case, White",269.99,Corsair,7000D AIRFLOW,ATX Full Tower,https://amazon.com/dp/B09444VWX2?tag=pcbuilder00-20
Phanteks Enthoo Primo Aluminum ATX Ultimate Full Tower Case,269.99,Phanteks,Enthoo Primo,ATX Full Tower,https://amazon.com/dp/B00SKAWE3S?tag=pcbuilder00-20
"be quiet! Dark Base PRO 900 Rev. 2, Full Tower ATX, 3 Pre-Installed Silent Wings 3 Fans, BGW15, Tempered Glass Window, RGB LED Illumination",279.9,be quiet!,Dark Base PRO 900,ATX Full Tower,https://amazon.com/dp/B07DWDQFSX?tag=pcbuilder00-20
Phanteks Enthoo Primo Aluminum ATX Ultimate Full Tower Computer Case,279.99,Phanteks,PH-ES813P_BL,ATX Full Tower,https://amazon.com/dp/B00EB0A6FE?tag=pcbuilder00-20
"CORSAIR iCUE 7000X RGB Full-Tower ATX PC Case, White",280.04,Corsair,CC-9011227-WW,ATX Full Tower,https://amazon.com/dp/B094464GV5?tag=pcbuilder00-20
"be quiet! Dark Base 900 Full Tower ATX, 3 Pre-Installed Silent Wings 3 Fans",285.45,be quiet!,Dark Base 900,ATX Full Tower,https://amazon.com/dp/B01H6JQAJ2?tag=pcbuilder00-20
"anidees AI Crystal XL PRO LITE Full Tower Tempered Glass XL-ATX/E-ATX/ATX Gaming Case Support 480/360 Radiator, Optical Drive - AI-XL-PRO-LITE",289.9,ANIDEES,AI CRYSTAL XL PRO LITE,ATX Full Tower,https://amazon.com/dp/B081M3JJ5C?tag=pcbuilder00-20
Phanteks Enthoo Series Primo Aluminum ATX Ultimate Full Tower Computer Case,293.01,Phanteks,Enthoo Primo,ATX Full Tower,https://amazon.com/dp/B00HRJHEWO?tag=pcbuilder00-20
Thermaltake Tower 900 Snow Edition Tempered Glass Fully Modular E-ATX Vertical Super Tower Computer Chassis,297.76,Thermaltake,Tower 900 Snow,ATX Full Tower,https://amazon.com/dp/B01MTOVX8D?tag=pcbuilder00-20
Phanteks Enthoo Series Primo Aluminum ATX Ultimate Full Tower Computer Case,298.07,Phanteks,Enthoo Primo,ATX Full Tower,https://amazon.com/dp/B00S3964FA?tag=pcbuilder00-20
"Lian Li Odyssey X Black Tempered Glass on The Left and Right Sides, Aluminum Full Tower Gaming Computer Case - TR-01X",299,Lian Li,Odyssey X Black,ATX Full Tower,https://amazon.com/dp/B0995Q6TND?tag=pcbuilder00-20
"Cooler Master HAF 700 E-ATX High Airflow PC Case, Mesh Front Panel, Dual 200mm Sickleflow Customizable ARG Fans",299.99,Cooler Master,9B11-119-437,ATX Full Tower,https://amazon.com/dp/B0B57G9BHC?tag=pcbuilder00-20
Thermaltake AH T600 Snow Helicopter Styled Open Frame Tempered Glass Swing Door E-ATX Full Tower Case,299.99,Thermaltake,AH T600 Snow,ATX Full Tower,https://amazon.com/dp/B084JKHHZ4?tag=pcbuilder00-20
Thermaltake AH T600 Helicopter Styled Open Frame Tempered Glass Swing Door E-ATX Full Tower Case,299.99,Thermaltake,AH T600,ATX Full Tower,https://amazon.com/dp/B084QH12KV?tag=pcbuilder00-20
Thermaltake View 51 TG ARGB Black Gaming Case,301.48,Thermaltake,View 51 TG,ATX Full Tower,https://amazon.com/dp/B083Z1PVRH?tag=pcbuilder00-20
"be quiet! Dark Base 900 Silver, Full Tower ATX, 3 Pre-Installed Silent Wings 3 Fans",313.85,be quiet!,Dark Base 900,ATX Full Tower,https://amazon.com/dp/B01H6JOECW?tag=pcbuilder00-20
"anidees AI Crystal XL RGB V3 Full Tower Tempered Glass,Steel Construction,Water-Cooling Ready PC Case (System not Included), Includes 5 x 120 RGB Fans, 2 x LED Strips",319.9,A ANIDEES,Crystal XL RGB V3,ATX Full Tower,https://amazon.com/dp/B07NW42KN9?tag=pcbuilder00-20
"ASUS ROG Strix Helios GX601 White Edition RGB Mid-Tower Computer Case for ATX/EATX Motherboards with Tempered Glass, Aluminum Frame, GPU Braces, 420mm Radiator Support and Aura Sync",323.1,ASUS,ROG Strix Helios GX601,ATX Full Tower,https://amazon.com/dp/B0896Y1K7B?tag=pcbuilder00-20
"be quiet! Dark Base PRO 900 Silver Rev. 2, Full Tower ATX, 3 Pre-Installed Silent Wings 3 Fans, BGW16, Tempered Glass Window, RGB LED",346.23,be quiet!,Dark Base PRO 900,ATX Full Tower,https://amazon.com/dp/B07DW6XF3G?tag=pcbuilder00-20
"Anidees AI Crystal XL PRO RGB Full Tower Tempered Glass XL-ATX/E-ATX/ATX Gaming Case Support 480/360 Radiator, Optical Drive",349.9,Anidees,AI Crystal XL,ATX Full Tower,https://amazon.com/dp/B081M3RGG8?tag=pcbuilder00-20
"CORSAIR iCUE 7000X RGB Full-Tower ATX PC Case, Black",365.04,Corsair,CC-9011226-WW,ATX Full Tower,https://amazon.com/dp/B09444T1R6?tag=pcbuilder00-20
AZZA CSAZ-811 Mesa Innovative ATX Case,369.99,AZZA,CSAZ-811,ATX Full Tower,https://amazon.com/dp/B0CHVDTRZP?tag=pcbuilder00-20
Lian Li V3000 Plus White GGF Edition Full Tower case - V3000PW,378,Lian Li,V3000PW,ATX Full Tower,https://amazon.com/dp/B0C137TW8F?tag=pcbuilder00-20
"LIAN LI V3000 Plus Black Tempered Glass on The Left Sides, Full Tower EATX Gaming Computer Case - V3000PX",378,Lian Li,V3000PX,ATX Full Tower,https://amazon.com/dp/B0BN3TZR5G?tag=pcbuilder00-20
Thermaltake Core W100 Extreme Water Cooling XL-ATX Fully Modular/Dismantle Stackable Tt LCS Certified Super Tower Computer Case,399.99,Thermaltake,Core W100,ATX Full Tower,https://amazon.com/dp/B01C71Q8WS?tag=pcbuilder00-20
lianli O11 Series with up to 12 Based Cooling Fan for midorutawa-ke-su o11air Japanese authorized agent product,403.69,Lian Li,PC-O11 Air,ATX Full Tower,https://amazon.com/dp/B07FJ6PMKW?tag=pcbuilder00-20
Thermaltake View 71 TG (Tempered Glass) RGB Plus PC-Case,422.9,Thermaltake,View 71 TG,ATX Full Tower,https://amazon.com/dp/B07JVTNWBZ?tag=pcbuilder00-20
"Cooler Master Cosmos C700P E-ATX Full-Tower with Curved Tempered Glass Panel, Flexible Interior Layout, Type-C Port & RGB Lighting Control",469.99,Cooler Master,Cosmos C700P,ATX Full Tower,https://amazon.com/dp/B07SCPVKFF?tag=pcbuilder00-20
"Cooler Master 30th Year Anniversary Cosmos Infinity C700M E-ATX Full-Tower Curved Tempered Glass Panel, Riser Cable PCIe 4.0, Diverse Liquid Cooling, Type-C, Customizable ARGB (MCC-C700M-KHNN-S30)",499.99,Cooler Master,MCC-C700M-KHNN-S30,ATX Full Tower,https://amazon.com/dp/B0BYZZD54G?tag=pcbuilder00-20
Thermaltake View 91 RGB PLUS Tempered Glass Vertical GPU Modular SPCC XL-ATX Gaming Super Tower Computer Case with 4 RGB Riing PLUS Fan,499.99,Thermaltake,View 91 RGB,ATX Full Tower,https://amazon.com/dp/B079FZ77DB?tag=pcbuilder00-20
Thermaltake Core W200 Dual System Capable Extreme Water Cooling XL-ATX Fully Modular/Dismantle Stackable Tt Certified Super Tower Computer Case,549.99,Thermaltake,Core W200,ATX Full Tower,https://amazon.com/dp/B01EGBZA1C?tag=pcbuilder00-20
"Cooler Master Cosmos C700M E-ATX Full-Tower with Curved Tempered Glass Panel, Riser Cable, Flexible Interior Layout, Diverse Liquid Cooling Layout, Type-C Port & ARGB Lighting Control",599.99,Cooler Master,Cosmos C700M,ATX Full Tower,https://amazon.com/dp/B07H6MKSXZ?tag=pcbuilder00-20
"Jonsplus i400 ATX Gehäuse, Tempered Glass - Silber",641.95,Jonsplus,CSAZ-811,ATX Full Tower,https://amazon.com/dp/B09Y3HTGT6?tag=pcbuilder00-20
"JONSPLUS i400 ATX Gehäuse, Tempered Glass - Schwarz",699.92,Jonsplus,Gemini X,ATX Full Tower,https://amazon.com/dp/B0BK5FWPCX?tag=pcbuilder00-20
"Cooler Master HAF 700 EVO E-ATX High Airflow PC Case with Breathable TG Front Panel, 200mm Sickleflow ARGB Fans",995,Cooler Master,H700E-IGNN-S00,ATX Full Tower,https://amazon.com/dp/B09RVWCLRF?tag=pcbuilder00-20
Thermaltake Level 20 E-ATX Full Tower Gaming Computer PC Case with 3 Riing Plus 140mm RGB Fan + 2 Lumi Plus LED Strips Pre-Installed,999.99,Thermaltake,Level 20,ATX Full Tower,https://amazon.com/dp/B07HHN6KCS?tag=pcbuilder00-20
"SilverStone Technology ALTA F2 Premium Super Tower Chassis, SST-ALF2B-G",999.99,SilverStone Technology,SST-ALF2B-G,ATX Full Tower,https://amazon.com/dp/B0C5LF52TL?tag=pcbuilder00-20
"MSI MAG Forge 100M Mid Tower Gaming Computer Case Black, 2X 120 mm RGB PWM Fan, 1x 120 mm Fan, 1-6 RGB Hub, Tempered Glass Panel, ATX, mATX, Mini-ITX - 306-7G03M11-809",47.3,MSI,MAG FORGE 100M,ATX Mid Tower,https://amazon.com/dp/B07YQ724L8?tag=pcbuilder00-20
Antec Budget Gamer NX100 Grey,47.84,Antec,NX100,ATX Mid Tower,https://amazon.com/dp/B07M7Y27VX?tag=pcbuilder00-20
DIYPC J180-W White SPCC ATX Mid Tower Computer Case,49.98,DIYPC,J180,ATX Mid Tower,https://amazon.com/dp/B01JMLBQT6?tag=pcbuilder00-20
DIYPC J180BL BLACK SPCC ATX Mid Tower Computer Case,49.98,DIYPC,J180BL,ATX Mid Tower,https://amazon.com/dp/B01L7VB6TO?tag=pcbuilder00-20
NZXT H510i - CA-H510i-B1 - Compact ATX Mid-Tower PC Gaming Case - Front I/O USB Type-C Port - Vertical GPU Mount - Tempered Glass Side Panel - Integrated RGB Lighting,49.99,NZXT,H510i,ATX Mid Tower,https://amazon.com/dp/B07TC73F72?tag=pcbuilder00-20
"Cooler Master Q300L V2 Micro-ATX Tower, Magnetic Patterned Dust Filter, USB 3.2 Gen 2x2 (20GB), Tempered Glass Panel, CPU Coolers Max 159mm, GPU Max 360mm, Fully Ventilated Airflow (Q300LV2-KGNN-S00)",49.99,Cooler Master,Q300LV2-KGNN-S00,ATX Mid Tower,https://amazon.com/dp/B0CB8WGGNW?tag=pcbuilder00-20
"ASUS TUF Gaming GT301 Mid-Tower Compact Case for ATX Motherboards with Honeycomb Front Panel, 120mm Aura Addressable RBG Fans, Headphone Hanger, and 360mm Radiator Support, 2 x USB 3.2",50,ASUS,GT301 TUF GAMING CASE,ATX Mid Tower,https://amazon.com/dp/B088K5317Z?tag=pcbuilder00-20
COUGAR Mesh-G Powerful Airflow with Stunning ARGB Mid-Tower,50.86,COUGAR,MX331 MESH,ATX Mid Tower,https://amazon.com/dp/B08BX43M7T?tag=pcbuilder00-20
COUGAR MX410 Mesh Powerful and Compact Mid-Tower Case with Mesh Front Panel,50.86,COUGAR,MX410 MESH,ATX Mid Tower,https://amazon.com/dp/B089N6G9Z2?tag=pcbuilder00-20
AeroCool Tempered Glass RGB Mid Tower,50.99,AeroCool,Bolt-G,ATX Mid Tower,https://amazon.com/dp/B07SW2285W?tag=pcbuilder00-20
Sama Sama-S88-BK Case Sama Sama-s88-bk R,51.65,SAMA (Case & Power Supply),Sama-S88-BK,ATX Mid Tower,https://amazon.com/dp/B09X58MW2R?tag=pcbuilder00-20
Cougar Middle Tower Cases,52,COUGAR,MX330-X,ATX Mid Tower,https://amazon.com/dp/B074LRNC44?tag=pcbuilder00-20
COUGAR Mesh-G Powerful Airflow with Stunning ARGB Mid-Tower,52,COUGAR,MX331,ATX Mid Tower,https://amazon.com/dp/B08BWRSC91?tag=pcbuilder00-20
"MSI MAG VAMPIRIC 100R Mid Tower Gaming Computer Case 'Black, 1x 120mm ARGB PWM Fan, 1x 120mm PWM Fan, RGB Front Panel",52.2,MSI,306-7G07R25-809,ATX Mid Tower,https://amazon.com/dp/B08KHK67RP?tag=pcbuilder00-20
"Zalman S5 ATX Mid Tower Gaming Computer/PC Case with Pre-Installed 2X 120mm Fans, Tempered Glass with RGB LED Control Button",53.3,Zalman,S5 White,ATX Mid Tower,https://amazon.com/dp/B084JM9VMB?tag=pcbuilder00-20
AeroCool Cylon RGB Mid Tower with Acrylic Side Window,54.99,AeroCool,Cylon RGB,ATX Mid Tower,https://amazon.com/dp/B079P1VBDY?tag=pcbuilder00-20
Thermaltake Versa H21 SPCC ATX Mid Tower Computer Chassis,54.99,Thermaltake,Versa H21,ATX Mid Tower,https://amazon.com/dp/B00J0NZ3Q4?tag=pcbuilder00-20
"Zalman S2 ATX Mid Tower Computer/PC Case with Full Acrylic Tinted Side Panel, Three 120mm Fan Pre-Installed",54.99,Zalman,S2,ATX Mid Tower,https://amazon.com/dp/B07P23M99T?tag=pcbuilder00-20
"Zalman S3 ATX Mid Tower Computer PC Case, Pre-Installed Three (3) x 120mm Fans with Smoky Acrylic Side Panel and Patterned Mesh Design",54.99,Zalman,S3,ATX Mid Tower,https://amazon.com/dp/B07NZYJ9ZJ?tag=pcbuilder00-20
"Zalman T6 ATX Mid Tower Computer PC Case, Pre-Installed 120mm Fan, 5.25 ODD, USB 3.0, Patterned Mesh Design, mATX ITX for Gaming Workstation, Black",54.99,Zalman,T6,ATX Mid Tower,https://amazon.com/dp/B07R2JBTDR?tag=pcbuilder00-20
COUGAR MX330 Mid Tower Case with Full Acrylic Transparent Window,55,COUGAR,MX330,ATX Mid Tower,https://amazon.com/dp/B074RC5BWV?tag=pcbuilder00-20
"Rosewill ATX Case, Mid Tower Case with Blue LED Fan/Gaming Case for PC with Side Window Panel & 3 Fans Pre-Installed",55.85,Rosewill,NAUTILUS,ATX Mid Tower,https://amazon.com/dp/B01IT0TDY6?tag=pcbuilder00-20
"Cooler Master MasterBox Q500L Micro-ATX Tower with ATX Motherboard Support, Magnetic Dust Filter, Transparent Acrylic Side Panel, Adjustable I/O & Fully Ventilated Airflow",56.11,Cooler Master,MasterBox Q500L,ATX Mid Tower,https://amazon.com/dp/B07Q8VJ17J?tag=pcbuilder00-20
COUGAR DarkBlader X5 Distinctive Mid-Tower Case with Superior Airflow,57,COUGAR,DarkBlader X5,ATX Mid Tower,https://amazon.com/dp/B08J6WSXSM?tag=pcbuilder00-20
Fractal Design Focus G - Mid Tower Computer Case - ATX - High Airflow - 2X Silent ll Series 120mm White LED Fans Included,57.07,Fractal Design,Silent ll,ATX Mid Tower,https://amazon.com/dp/B074PTN1KR?tag=pcbuilder00-20
Fractal Design Focus G - Mid Tower Computer Case - ATX - High Airflow - 2X Silent ll Series 120mm White LED Fans Included - USB 3.0 - Window Side Panel,57.94,Fractal Design,Focus G,ATX Mid Tower,https://amazon.com/dp/B074PTNZ7F?tag=pcbuilder00-20
DEEPCOOL MATREXX 50 ATX Mid Tower/3pcs ARGB Cooling Fan/Front Panel and Side Panel Tempered Glass/PSU Cover/E-ATX MB Supported,59.33,DEEP COOL,MATREXX 50,ATX Mid Tower,https://amazon.com/dp/B07WNKT6J4?tag=pcbuilder00-20
COUGAR Mesh-G Powerful Airflow with Stunning ARGB Mid-Tower,59.9,COUGAR,MX331,ATX Mid Tower,https://amazon.com/dp/B08BX3KRXJ?tag=pcbuilder00-20
"BitFenix Nova Mesh SE TG PC Gaming Case with 2 Black Fans, ATX/Micro ATX/Mini ITX/Tempered Glass, Black",59.9,BITFENIX,NOVA MESH SE TG,ATX Mid Tower,https://amazon.com/dp/B09SHKYT37?tag=pcbuilder00-20
NZXT H510 Compact ATX Mid-Tower PC Gaming Case - Front I/O USB Type-C Port - Tempered Glass Side Panel - Cable Management System - Water-Cooling Ready,59.99,NZXT,H510B,ATX Mid Tower,https://amazon.com/dp/B07TC73F6Y?tag=pcbuilder00-20
"Zalman S2 ATX Mid Tower Computer Case with 3X Pre-Installed 120mm Fan, Tinted Tempered Glass Panel w/ Patterned Mesh Design, for Desktop Workstations Gaming",59.99,Zalman,S2,ATX Mid Tower,https://amazon.com/dp/B08FP4HV3T?tag=pcbuilder00-20
