Title,Price,Brand,Model,Cabinet Type,Link
Corsair iCUE 5000D RGB Airflow Mid-Tower Case - 3X AF120 RGB Elite Fans - iCUE Lighting Node PRO Controller - High-Airflow Design - CORSAIR RapidRoute Cable Management System - True White,218.35,Corsair,CC-9011243-WW,ATX Mid Tower,https://amazon.com/dp/B0BKC8V2L2?tag=pcbuilder00-20
Fractal Design Torrent RGB White E-ATX Tempered Glass Window High-Airflow Mid Tower Computer Case,219.3,Fractal Design,FD-C-TOR1A-07,ATX Mid Tower,https://amazon.com/dp/B09XQS5GJN?tag=pcbuilder00-20
NZXT H710i ATX Mid Tower PC Gaming Case - Front I/O USB Type-C Port - Quick-Release Tempered Glass Side Panel - Vertical GPU Mount - Integrated RGB Lighting,220.99,NZXT,H710i,ATX Mid Tower,https://amazon.com/dp/B07T7L8HQ5?tag=pcbuilder00-20
Silverstone RL05BW-W Motherboard Micro ATX - 12 x 10.2 in.44,222.49,SilverStone Technology,RL05BW-W,ATX Mid Tower,https://amazon.com/dp/B076QDPRM4?tag=pcbuilder00-20
Lian Li LAN2MRW LANCOOL II MESH RGB,229,Lian Li,LAN2MRW,ATX Mid Tower,https://amazon.com/dp/B08CSRXFSQ?tag=pcbuilder00-20
be quiet! Dark Base 701 PC Case | Integrated Silent Wings Fans | ARGB Lighting | Black | BGW58,229.9,be quiet!,BGW58,ATX Mid Tower,https://amazon.com/dp/B0CKXY7BPQ?tag=pcbuilder00-20
be quiet! Shadow Base 800 FX - ARGB - 4 Light Wings 140mm PWM Fans - Mid-Tower PC Gaming Case - 420mm radiators or E-ATX motherboards Support -White - BGW64,229.9,be quiet!,BGW64,ATX Mid Tower,https://amazon.com/dp/B0C597FL85?tag=pcbuilder00-20
"Corsair Carbide 275R Mid-Tower Gaming Case, Window Side Panel",229.99,Corsair,Carbide 275R,ATX Mid Tower,https://amazon.com/dp/B079JVTPJK?tag=pcbuilder00-20
InWin 904.Plus Black ATX Mid Tower Gaming Computer Case with Tempered Glass,231.23,IN WIN,904.Plus Black,ATX Mid Tower,https://amazon.com/dp/B00RUB1SN0?tag=pcbuilder00-20
Fractal Design Torrent RGB Black - Light Tint Tempered Glass Panels - Open Grille for Maximum air Intake - Two 180mm RGB PWM and Three 140mm RGB Fans Included - ATX Airflow Mid Tower PC Gaming Case,231.25,Fractal Design,FD-C-TOR1A-04,ATX Mid Tower,https://amazon.com/dp/B08699NR75?tag=pcbuilder00-20
AZZA Apollo 430B-DF2 Tower Case Black/Grey Tempered Glass,231.98,AZZA,430B,ATX Mid Tower,https://amazon.com/dp/B002VA87W0?tag=pcbuilder00-20
"NZXT H9 Elite Dual-Chamber ATX Mid-Tower PC Gaming Case ??Includes 3 x 120mm F120 RGB Duo Fans with Controller??Glass Front, Top & Side Panels ??360mm Radiator Support ??Cable Management ??Black",232.37,NZXT,CM-H91EB-01,ATX Mid Tower,https://amazon.com/dp/B0BG196XDP?tag=pcbuilder00-20
PrimoChill's Praxis Wetbench Powdercoated Steel Modular Open Air Computer Test Bench for Watercooling or Air Cooled Components,234.99,PrimoChill,MWB-BK-BK,ATX Mid Tower,https://amazon.com/dp/B01GGK5UO8?tag=pcbuilder00-20
"Cooler Master MasterCase Mesh White ATX Mid-Tower w/ Front Mesh Ventilation, 2x 200mm RGB Fans, Tempered Glass Side Panel And 2x Vertical GPU Card PCI Slots",236.24,Cooler Master,MasterCase Mesh S00,ATX Mid Tower,https://amazon.com/dp/B01MDS8L83?tag=pcbuilder00-20
Silverstone Technology CS380B Silverstone DIY ATX NAS Storage Case with Hot Swap Cases,236.34,SilverStone Technology,CS380B,ATX Mid Tower,https://amazon.com/dp/B01MA6NJE8?tag=pcbuilder00-20
"NZXT H9 Elite Dual-Chamber ATX Mid-Tower PC Gaming Case ??Includes 3 x 120mm F120 RGB Duo Fans with Controller??Glass Front, Top & Side Panels 360mm Radiator Support Cable Management White",238.75,NZXT,CM-H91EW-01,ATX Mid Tower,https://amazon.com/dp/B0BFZZVDZR?tag=pcbuilder00-20
"MSI MPG SEKIRA 500X Full Tower Gaming Computer Case 'Black, 3x200mm ARGB + 1x200mm + 1x120mm ARGB Fans, Mystic Light ARGB Hub, USB Type-C, Tempered Glass",239.99,MSI,SEKIRA 500X,ATX Mid Tower,https://amazon.com/dp/B07V462M6M?tag=pcbuilder00-20
Phanteks Enthoo Evolv X ATX Case Tempered Glass Windows Digital RGB Anthracite,240.99,Phanteks,Enthoo Evolv X,ATX Mid Tower,https://amazon.com/dp/B07GY355N2?tag=pcbuilder00-20
Corsair Carbide Series 100R Silent Edition Quiet Mid Tower Case,242,Corsair,Carbide 100R,ATX Mid Tower,https://amazon.com/dp/B00RORBQSW?tag=pcbuilder00-20
Zalman Iceberg Z3 PC Case White S3-600W,243.71,Zalman,S3-600W,ATX Mid Tower,https://amazon.com/dp/B0851G8BSV?tag=pcbuilder00-20
"CORSAIR 7000D AIRFLOW Full-Tower ATX PC Case, Black",244.99,Corsair,7000D AIRFLOW,ATX Mid Tower,https://amazon.com/dp/B094442NL5?tag=pcbuilder00-20
Phanteks Enthoo Evolv X ATX Case Tempered Glass Windows Digital RGB,244.99,Phanteks,Enthoo Evolv X,ATX Mid Tower,https://amazon.com/dp/B07GY26TZJ?tag=pcbuilder00-20
"SilverStone Temjin Series SST-TJ04B-E Black Aluminum front panel, steel body ATX Mid Tower Computer Case",246.49,SilverStone Technology,TJ04B-E,ATX Mid Tower,https://amazon.com/dp/B0078ZZ2FI?tag=pcbuilder00-20
Fractal Design Torrent Black TG Dark Tint,248.67,Fractal Design,FD-C-TOR1A-06,ATX Mid Tower,https://amazon.com/dp/B0869DD92T?tag=pcbuilder00-20
"PHANTEKS Thermal Solutions (PH-ES518XTG_DMW01) Evolv X EATX Mid-Tower, Aluminum",249.99,PHANTEKS THERMAL SOLUTIONS,PH-E518XTG_DMW01,ATX Mid Tower,https://amazon.com/dp/B09RZVHSGB?tag=pcbuilder00-20
"Corsair Obsidian 500D RGB SE Premium Mid-Tower Case, 3 RGB Fans, Smoked Tempered Glass, Aluminum Trim, Integrated Commander PRO fan and lighting controller",256,Corsair,Obsidian 500D,ATX Mid Tower,https://amazon.com/dp/B07C46L1D8?tag=pcbuilder00-20
Fractal Design Torrent E-ATX Black Solid High-Airflow Mid Tower Computer Case,258.12,Fractal Design,FD-C-TOR1A-05,ATX Mid Tower,https://amazon.com/dp/B099X5T116?tag=pcbuilder00-20
NZXT H700 - ATX Mid-Tower PC Gaming Case - Tempered Glass Panel - Enhanced Cable Management System,265.53,NZXT,H700i Ninja,ATX Mid Tower,https://amazon.com/dp/B07D95LYNW?tag=pcbuilder00-20
Thermaltake A500 Aluminum Tempered Glass ATX Mid Tower Gaming Computer Case with 3 Fans Pre-Installed,269.99,Thermaltake,A500,ATX Mid Tower,https://amazon.com/dp/B07JDF4SSZ?tag=pcbuilder00-20
"Cooler Master MasterCase SL600M Black Edition ATX Mid-Tower with Aluminum Panels, Vertical Chimney Layout, Type-C I/O Panel",271.96,Cooler Master,MasterCase SL600M,ATX Mid Tower,https://amazon.com/dp/B07ZTZ8RHB?tag=pcbuilder00-20
Kolink Stronghold for PC Casing,273,Kolink,STRONGHOLD,ATX Mid Tower,https://amazon.com/dp/B07B3VCPM2?tag=pcbuilder00-20
Corsair Crystal Series 680X RGB High Airflow Tempered Glass ATX Smart Case,274.99,Corsair,Crystal Series 680X,ATX Mid Tower,https://amazon.com/dp/B07MFR1VDN?tag=pcbuilder00-20
Thermaltake Core P6 TG Turquoise Mid-Tower ATX PC Case 3 x Hardened 4 mm Glass Side Panel Wall Mount Turquoise,284.99,Thermaltake,CA-1V2-00MBWN-00,ATX Mid Tower,https://amazon.com/dp/B09NQBX1S1?tag=pcbuilder00-20
SilverStone Technology ALTA F1 Premium Tower case with Aluminum/Tempered Glass Exterior & Embedded ARGB,293.99,SilverStone Technology,SST-ALF1S-G,ATX Mid Tower,https://amazon.com/dp/B09JDVTTBL?tag=pcbuilder00-20
"MSI MPG GUNGNIR 100 Mid Tower Gaming Computer Case 'Black, 1x 120mm ARGB + 3X 120mm Fan, Mystic Light Sync, 8 Channel ARGB Hub",296,MSI,Gungnir 100,ATX Mid Tower,https://amazon.com/dp/B07MZFGFDH?tag=pcbuilder00-20
"BitFenix Dawn TG EATX(272mm)/ATX ARGB PC Gaming Case, USB 3.1 Type C, Tempered Glass with Car Window Security Films, AIO support",298,BITFENIX,BFC-DAW-500-KKGSK-RP,ATX Mid Tower,https://amazon.com/dp/B083L8HQTZ?tag=pcbuilder00-20
CORSAIR iCUE 5000T RGB Mid-Tower ATX PC Case-208 Individually Addressable RGB LEDs-Fits Multiple 360mm Radiators-Easy Cable Management-3 Included CORSAIR LL120 RGB Fans- White,299.99,Corsair,CC-9011231-WW,ATX Mid Tower,https://amazon.com/dp/B09K21MXM8?tag=pcbuilder00-20
Kolink Boitier Grand-Tour ATX Kolink Observatory RGB avec panneaux vitrés,302,Kolink,OBSERVATORY RGB,ATX Mid Tower,https://amazon.com/dp/B07B41P14Y?tag=pcbuilder00-20
QUADSTELLAR INFINITY PC case with unique design and 4 independent blocks for high scalability and cooling efficiency,303.58,DeepCool,R-QUADSTELLAR-G-1,ATX Mid Tower,https://amazon.com/dp/B0BM9PL8BT?tag=pcbuilder00-20
SilverStone Technology ALTA F1 Premium ATX Tower case with Aluminum/Tempered Glass Exterior & Embedded ARGB,308.99,SilverStone Technology,SST-ALF1B-G,ATX Mid Tower,https://amazon.com/dp/B09JDGWDY8?tag=pcbuilder00-20
"MSI MAG VAMPIRIC 300R Midnight Green Mid-Tower PC Case - Tempered Glass, E-ATX Motherboard & Dual 360mm Radiator Capacity, GPU Support Bracket, Smart I/O, ARGB LED Panel & 120mm Fan - Mystic Light",312.91,MSI,306-7G19G21-809,ATX Mid Tower,https://amazon.com/dp/B097B15MGN?tag=pcbuilder00-20
Cooler Master MasterBox E501L | PC Case,320.54,Cooler Master,MCB E501L,ATX Mid Tower,https://amazon.com/dp/B07ZHCNHDJ?tag=pcbuilder00-20
Corsair iCUE 5000X RGB QL Edition Mid-Tower Case - True White,329.99,Corsair,CC-9011233-WW,ATX Mid Tower,https://amazon.com/dp/B09GJBCZYF?tag=pcbuilder00-20
RM42-502 SilverStone Technology 4U rackmount Server Chassis with Liquid Cooling Compatibility,333.36,SilverStone Technology,RM42-502,ATX Mid Tower,https://amazon.com/dp/B08DK8398B?tag=pcbuilder00-20
"Bitfenix Enso Mesh Case Black ARGB Edition, Mesh Front Panel, Tempered Glass Window Side Panel, ATX/Micro ATX/Mini ITX Form Factor",334,BITFENIX,Enso Mesh,ATX Mid Tower,https://amazon.com/dp/B08XVXC67J?tag=pcbuilder00-20
"MSI MEG Prospect 700R ??4.3"" Touch Panel Display - Tempered Glass Side Panel - Vertical GPU Mount ??4X ARGB 120mm Fan ??Liquid Cooling Support up to 360mm Radiator x 1 ??Cable Management System",339.99,MSI,9B11-320-052,ATX Mid Tower,https://amazon.com/dp/B0BJ14WPT5?tag=pcbuilder00-20
AZZA Opus 809 ATX Case - Dual Orientation - CNC-Milled Aluminum - 4-Side Tempered Glass,349.99,AZZA,CSAZ-809 OPUS,ATX Mid Tower,https://amazon.com/dp/B09KLJDJQS?tag=pcbuilder00-20
Cougar CONQUER ATX Gaming Case - / Mini ITX / Micro ATX PC Case / ATX Computer Case- Mid Tower,352.43,COUGAR,CONQUER,ATX Mid Tower,https://amazon.com/dp/B0759PNHX8?tag=pcbuilder00-20
Thermaltake View 28 RGB Riing Edition Gull-Wing Window ATX Mid-Tower Chassis,359.99,Thermaltake,View 28,ATX Mid Tower,https://amazon.com/dp/B0719JXP8X?tag=pcbuilder00-20
be quiet! BGW06 Silent Base 600 Window ATX Mid Tower Computer Case,365,be quiet!,Silent Base 600,ATX Mid Tower,https://amazon.com/dp/B014VZD8G2?tag=pcbuilder00-20
"be quiet! BGW07 Silent Base 600 Window Case, Silver",365,be quiet!,Silent Base 600,ATX Mid Tower,https://amazon.com/dp/B014VZI3GC?tag=pcbuilder00-20
be quiet! BGW05 Silent Base 600 Window ATX Mid Tower Computer Case,365,be quiet!,Silent Base 600,ATX Mid Tower,https://amazon.com/dp/B014VZFVDU?tag=pcbuilder00-20
"Corsair Crystal 570X RGB Mid-Tower Case, 3 RGB Fans, Tempered Glass",369.26,Corsair,Crystal 570X RGB,ATX Mid Tower,https://amazon.com/dp/B01LE0ZKR2?tag=pcbuilder00-20
CORSAIR iCUE 5000T RGB Mid-Tower ATX PC Case-208 Individually Addressable RGB LEDs-Fits Multiple 360mm,369.99,Corsair,CC-9011230-WW,ATX Mid Tower,https://amazon.com/dp/B09K1YNJTR?tag=pcbuilder00-20
Corsair 275R Airflow Tempered Glass Mid-Tower Gaming Case,378.45,Corsair,275R Airflow,ATX Mid Tower,https://amazon.com/dp/B07VNB23RZ?tag=pcbuilder00-20
Antec Torque Aluminum ATX Mid Tower Computer Case/Winner of iF Design Award 2019,379.99,Antec,Torque,ATX Mid Tower,https://amazon.com/dp/B07HG9KZVX?tag=pcbuilder00-20
"JONSPLUS i400 ATX Gehäuse, Tempered Glass - Silber",382.12,Jonsplus,i 400 BA,ATX Mid Tower,https://amazon.com/dp/B0BK5GW1DV?tag=pcbuilder00-20
"be quiet! BG007 Silent Base 600 Case, Silver",393,be quiet!,BG007,ATX Mid Tower,https://amazon.com/dp/B014VZEAD2?tag=pcbuilder00-20
Kolink Castle Midi Tower Tempered Glass - Black,393,Kolink,CASTLE,ATX Mid Tower,https://amazon.com/dp/B07W6P288V?tag=pcbuilder00-20
AZZA CSAZ-804L Pyramid Innovative ATX case,399.99,AZZA,CSAZ-804L PYRAMID,ATX Mid Tower,https://amazon.com/dp/B08R765PXW?tag=pcbuilder00-20
AZZA Regis 902 - Luxury Cube Case | Infinity RGB Panel | 3-Sided Tempered Glass | CNC Milled Aluminum Stand,399.99,AZZA,CSAZ-902 REGIS,ATX Mid Tower,https://amazon.com/dp/B09JNDQKXD?tag=pcbuilder00-20
"AZZA Pyramid Mesh PC Case - ATX Pyramid Enclosure with Mesh Panels & Anodized Aluminum Frame, E-ATX MB & 360mm Radiator Support, 120mm ARGB Apex Fan - PCI-e 4.0 x16 Riser Cable & GPU Holder",419.99,AZZA,CSAZ-804M,ATX Mid Tower,https://amazon.com/dp/B0BF54B4CQ?tag=pcbuilder00-20
"Corsair Carbide SPEC-Omega Mid-Tower Gaming Case, Tempered Glass",439.98,Corsair,Carbide SPEC-Omega,ATX Mid Tower,https://amazon.com/dp/B077G34G9W?tag=pcbuilder00-20
"Cooler Master MasterBox MB511 - ATX PC Case with Front Mesh Panel, Racing Intakes, Transparent Side Panel, Flexible Air Flow Configurations",460,Cooler Master,MCB-B511D-KANN-S01,ATX Mid Tower,https://amazon.com/dp/B07CZH4H6M?tag=pcbuilder00-20
"AZZA Thor 320DH RGB Tower Case, Black, Tempered Glass",464,AZZA,CSAZ 320DH,ATX Mid Tower,https://amazon.com/dp/B07HKYCPWV?tag=pcbuilder00-20
Cougar Cratus Mid Tower RGB Case with Variety of Customization Features and Convection Dynamics,489.81,COUGAR,385LMS0.0001,ATX Mid Tower,https://amazon.com/dp/B0BVGTFC5H?tag=pcbuilder00-20
Corsair Carbide Series 678C Low Noise Tempered Glass ATX Case,515.92,Corsair,Carbide 678R,ATX Mid Tower,https://amazon.com/dp/B07MG8LB9J?tag=pcbuilder00-20
"Kolink Unity Code X PC Case for Water Cooling, Mid Tower Case with ARGB Illuminated Front, Glass PC Housing with Vertical GPU Installation Possible, Tempered Glass Case for PC, Computer Case ATX",528,Kolink,PGW-CH-KOL-088,ATX Mid Tower,https://amazon.com/dp/B09DSVCH1B?tag=pcbuilder00-20
Thermaltake H100 TG ATX Mid Tower Chassis,537,Thermaltake,H100 TG,ATX Mid Tower,https://amazon.com/dp/B07TTLR6QC?tag=pcbuilder00-20
"Jonsbo TR03-A Showcase, Tempered Glass",551,Jonsbo,TR03-A,ATX Mid Tower,https://amazon.com/dp/B08KP2ZN33?tag=pcbuilder00-20
"MSI MPG SEKIRA 500G Full Tower Gaming Computer Case 'Black with Gold Trim, 2X 200mm + 1x120mm Fans, USB Type-C, Tempered Glass Panel",575.85,MSI,Sekira 500G,ATX Mid Tower,https://amazon.com/dp/B07V1NZ7TZ?tag=pcbuilder00-20
Thermaltake Tower 200 Mini-ITX Computer Case; 2x140mm Pre-Installed CT140 Fans; Supports GPU Length Up to 380mm; CA-1X9-00SCWN-00; Racing Green; 3 Year Warranty,148.37,Thermaltake,CA-1X9-00SCWN-00,ATX Mini Tower,https://amazon.com/dp/B0CGW7HY7S?tag=pcbuilder00-20
SSUPD Meshroom S Mini-ITX Gehäuse PCIe 4.0 - Schwarz,280.2,SSUPD,SSU-MESH-S-BK-PCI4,ATX Mini Tower,https://amazon.com/dp/B0BJ61NFWW?tag=pcbuilder00-20
SSUPD Meshroom S Mini-ITX Small Form Factor (SFF) Case - Full Mesh Side Panel with PCIe 4.0 Riser Cable - Tool-Free and Easy Accessibility (Blue),347.37,SSUPD,SSU-MESH-S-BU-PCI4,ATX Mini Tower,https://amazon.com/dp/B0BBF5VJH6?tag=pcbuilder00-20
"CiT Home ARGB PC Case, Micro-ATX, Minimalist Design, Spacious Interior, Room to Mount 4 Fans, ARGB LED Strip, Two USB Ports Included, High Performance Chassis for Home and Office Environments | Black",31.53,CiT,CiTHOMERGB,MicroATX Mid Tower,https://amazon.com/dp/B08G571LHG?tag=pcbuilder00-20
"RAIJINTEK Ophion M Evo TGS Micro-ATX, Tempered Glass",49,RAIJINTEK Corporation,02R20B00135,MicroATX Mid Tower,https://amazon.com/dp/B07RHZPRQK?tag=pcbuilder00-20
Fractal Design Core 1000 USB 3.0 Cases,49.21,Fractal Design,Core 1000,MicroATX Mid Tower,https://amazon.com/dp/B00CUSUV0O?tag=pcbuilder00-20
Thermaltake Level 20 VT Tempered Glass Interchangeable Panel DIY LCS Chamber Concept Micro ATX Modular Gaming Computer Case,50,Thermaltake,Level 20 VT,MicroATX Mid Tower,https://amazon.com/dp/B07FDFZDDW?tag=pcbuilder00-20
"Antec NX200 M White, Micro-ATX Tower, Mini-Tower Computer Case with 120mm Rear Fan Pre-Installed, Mesh Design in Front Panel Ventilated Airflow, NX Series",54.99,Antec,CAA-NX200M-WH,MicroATX Mid Tower,https://amazon.com/dp/B0CG61R136?tag=pcbuilder00-20
"Antec NX200 M, Micro-ATX Tower, Mini-Tower Computer Case with 120mm Rear Fan Pre-InstalleD",59.99,Antec,0-761345-81027-2,MicroATX Mid Tower,https://amazon.com/dp/B094NK5M4M?tag=pcbuilder00-20
"DeepCool CH370 WH Micro ATX Gaming Computer Case, 120mm Rear Fan Pre-Installed, Ventilated Airflow Design, Built-in Headphone Stand, White",61.99,DeepCool,CH370 WH,MicroATX Mid Tower,https://amazon.com/dp/B0BJ646MXJ?tag=pcbuilder00-20
"Cooler Master MasterBox NR400 Micro-ATX Towe with Front Mesh Ventilation, Minimal Design, Tempered Glass Side Panel and Single Headset Jack",62.2,Cooler Master,MasterBox NR400,MicroATX Mid Tower,https://amazon.com/dp/B07PDT745F?tag=pcbuilder00-20
"Antec Dark Phantom Series DP31 Mini-Tower M-ATX Gaming Case, Claw-Shaped Air Intakes, ARGB Strip",62.52,Antec,0-761345-80038-9,MicroATX Mid Tower,https://amazon.com/dp/B09GRCJFTC?tag=pcbuilder00-20
"Cooler Master MasterBox MB320L ARGB Micro-ATX with Dual ARGB Fans, DarkMirror Front Panel, Mesh Front Intake Vents, Tempered Glass Side Panel & ARGB Lighting System",63.99,Cooler Master,MasterBox MB320L,MicroATX Mid Tower,https://amazon.com/dp/B0842T2KWZ?tag=pcbuilder00-20
"Silverstone Micro-ATX, Mini-DTX, Mesh Front Panel, Steel Body, Tempered Glass Side Panel",64.99,SilverStone Technology,SST-PS15W-G,MicroATX Mid Tower,https://amazon.com/dp/B07XW3BVRM?tag=pcbuilder00-20
SilverStone Technology Micro-ATX Glass Computer Case,69.3,SilverStone Technology,SST-PS15B-G,MicroATX Mid Tower,https://amazon.com/dp/B07N1HL5PR?tag=pcbuilder00-20
AZZA Elise 140 / matx Gaming case/PC case / 1120mm ARGB Fan Included,69.99,AZZA,CSAZ-140 ELISE,MicroATX Mid Tower,https://amazon.com/dp/B09JSGYWD1?tag=pcbuilder00-20
"Antec VSK10 Window Value Solution Series Highly Functional Micro-ATX Case, Window Side Panel, Support 4 x 140 mm Fan and 280 mm",72.39,Antec,VSK10 Window,MicroATX Mid Tower,https://amazon.com/dp/B07T8LJGRT?tag=pcbuilder00-20
Cooler Master MasterBox Lite 3.1 TG mATX Case with Dark Mirror Front Temper Glass Side Panel Customizable,74,Cooler Master,MasterBox Lite 3.1,MicroATX Mid Tower,https://amazon.com/dp/B075MYYFC8?tag=pcbuilder00-20
Apex Case TX-606-U3,74,APEX LEGENDS,TX-606-U3,MicroATX Mid Tower,https://amazon.com/dp/B00BIBDOCG?tag=pcbuilder00-20
SilverStone Technology Micro-ATX Computer Case with Tempered Glass and 2 X RGB Front Intake Fans,77.73,SilverStone Technology,SST-PS15B-RGB,MicroATX Mid Tower,https://amazon.com/dp/B07SNFQVYS?tag=pcbuilder00-20
RAIJINTEK Ophion M Evo ALS Micro-ATX,79,Raijintek,Ophion M,MicroATX Mid Tower,https://amazon.com/dp/B07RM58MT3?tag=pcbuilder00-20
"LIAN LI High Airflow Micro ATX PC Case, RGB Gaming Computer Case, Mesh Front Panel Mid-Tower Chassis",79.99,Lian Li,LANCOOL 205M MESH BLACK,MicroATX Mid Tower,https://amazon.com/dp/B0B5TG9BP1?tag=pcbuilder00-20
Thermaltake V150 TG Breeze ARGB Motherboard Sync mATX Computer Case with 3x120mm 5V ARGB Fan Pre-Installed,79.99,Thermaltake,CA-1R1-00S1WN-02,MicroATX Mid Tower,https://amazon.com/dp/B09Q4KTNF4?tag=pcbuilder00-20
Antec Dapper Dark Phantom ARGB Lighting/Tempered Glass Side Panel Compact Micro-ATX Gaming Case,79.99,Antec,Dark Phantom DP301M,MicroATX Mid Tower,https://amazon.com/dp/B07N7J9WG9?tag=pcbuilder00-20
"Thermaltake Divider 170 TG ARGB Motherboard Sync mATX Computer Case with 2x120mm ARGB Fan Pre-Installed, Tempered Glass Side Panel, Ventilated Front Mesh Panel, CA-1S4-00S1WN-00, Black",79.99,Thermaltake,Divider 170 TG ARGB,MicroATX Mid Tower,https://amazon.com/dp/B0B8X433RM?tag=pcbuilder00-20
Thermaltake Divider 170 TG ARGB Motherboard Sync mATX Computer Case with 2x120mm ARGB Fan Pre-Installed,79.99,Thermaltake,CA-1S4-00S6WN-00,MicroATX Mid Tower,https://amazon.com/dp/B0B8X4YV2K?tag=pcbuilder00-20
Fractal Design Pop Mini Silent Black Solid,82.5,Fractal Design,FD-C-POS1M-01,MicroATX Mid Tower,https://amazon.com/dp/B08KTMP31V?tag=pcbuilder00-20
"DeepCool CH370 Micro ATX Gaming Computer Case, 120mm Rear Fan Pre-Installed, Ventilated Airflow Design, Built-in Headphone Stand, Black",84.79,DeepCool,CH370,MicroATX Mid Tower,https://amazon.com/dp/B0BJ6D6MPJ?tag=pcbuilder00-20
"Cooler Master MasterBox MB311L ARGB Airflow Micro-ATX Tower with Dual ARGB Fans, Fine Mesh Front Panel, Mesh Intake Vents, Tempered Glass Side Panel & ARGB Lighting System",89.99,Cooler Master,MasterBox MB311L,MicroATX Mid Tower,https://amazon.com/dp/B0842TKK19?tag=pcbuilder00-20
Fractal Design MicroATX Case Cases,89.99,Fractal Design,FD-CA-DEF-MINI-C-BK,MicroATX Mid Tower,https://amazon.com/dp/B01N05CPU8?tag=pcbuilder00-20
In-Win CE685.FH300TB3 300W MicroATX Slim Case,93.19,IN WIN,CE685.FH300TB3,MicroATX Mid Tower,https://amazon.com/dp/B00J8LZDSG?tag=pcbuilder00-20
Fractal Design Pop Mini Air RGB Black Tempered Glass Clear Tint,93.98,Fractal Design,FD-C-POR1M-06,MicroATX Mid Tower,https://amazon.com/dp/B08T1XD4V2?tag=pcbuilder00-20
Fractal Design Pop Mini Air RGB White Core Tempered Glass Clear Tint,93.98,Fractal Design,FD-C-POR1M-01,MicroATX Mid Tower,https://amazon.com/dp/B08KTM9L6P?tag=pcbuilder00-20
Thermaltake V150 Tempered Glass Micro-ATX Mini Tower Gaming Computer Case with One 120mm Rear Fan,98.79,Thermaltake,V150,MicroATX Mid Tower,https://amazon.com/dp/B08DHCBBG1?tag=pcbuilder00-20
"Lian Li Mid-Tower Chassis mATX Computer Case PC Gaming Case w/Tempered Glass Side Panel, Magnetic Dust Filter, Water-Cooling Ready, Side Ventilation and 2x120mm PWM Fan Pre-Installed",99.99,Lian Li,LANCOOL 205M,MicroATX Mid Tower,https://amazon.com/dp/B085YFY32L?tag=pcbuilder00-20
Fractal Design Meshify 2 Mini White TG Clear Tint,99.99,Fractal Design,FD-C-MES2M-02,MicroATX Mid Tower,https://amazon.com/dp/B09ZYK16L9?tag=pcbuilder00-20
Fractal Design Meshify 2 Mini Black TG Dark Tint,102.28,Fractal Design,FD-C-MES2M-01,MicroATX Mid Tower,https://amazon.com/dp/B09ZYJ7TQ1?tag=pcbuilder00-20
"Phanteks Eclipse P400A Digital ATX Mid-Tower, Mesh Front Panel, Tempered Glass, Digital-RGB",109.99,Phanteks,Eclipse P400A,MicroATX Mid Tower,https://amazon.com/dp/B07TTDW9KV?tag=pcbuilder00-20
"Lian Li microATX Mid-Tower Computer Case PC Gaming Case Chassis w/Tempered Glass Side Panel, Magnetic Dust Filter, Water-Cooling Ready",111.5,Lian Li,LANCOOL 205M,MicroATX Mid Tower,https://amazon.com/dp/B08R7S4C3P?tag=pcbuilder00-20
Fractal Design Node 804 No Power Supply MicroATX Cube Case,124.99,Fractal Design,Node 804,MicroATX Mid Tower,https://amazon.com/dp/B00K6OVG0I?tag=pcbuilder00-20
Thermaltake AH T200 Helicopter Styled Open Frame Tempered Glass Swing Door USB3.1 (Gen.2) Type-C,129.99,Thermaltake,CA-1R4-00S1WN-00,MicroATX Mid Tower,https://amazon.com/dp/B08KBTYQJL?tag=pcbuilder00-20
Thermaltake AH T200 Snow Helicopter Styled Open Frame Tempered Glass Swing Door USB3.1 (Gen.2) Type-C,129.99,Thermaltake,AH T200 Snow,MicroATX Mid Tower,https://amazon.com/dp/B08K9DX622?tag=pcbuilder00-20
Thermaltake AH T200 Pink Helicopter Styled Open Frame Tempered Glass Swing Door USB3.1 (Gen.2),129.99,Thermaltake,CA-1R4-00SAWN-00,MicroATX Mid Tower,https://amazon.com/dp/B08NXYG26J?tag=pcbuilder00-20
Thermaltake AH T200 Racing Green Helicopter Styled Open Frame Tempered Glass Swing Dorr USB3.1 (Gen.2) Type-C,129.99,Thermaltake,CA-1R4-00SCWN-00,MicroATX Mid Tower,https://amazon.com/dp/B09Q7H58MB?tag=pcbuilder00-20
Thermaltake AH T200 Turquoise Helicopter Styled Open Frame Tempered Glass Swing Dorr USB3.1 (Gen.2) Type-C,129.99,Thermaltake,CA-1R4-00SBWN-00,MicroATX Mid Tower,https://amazon.com/dp/B09Q7SNB49?tag=pcbuilder00-20
Corsair Crystal Series 280X,159.99,Corsair,Crystal 280X,MicroATX Mid Tower,https://amazon.com/dp/B07CJTKDZQ?tag=pcbuilder00-20
"SilverStone Technology ALTA G1M Micro-ATX Super Tower Case White, SST-ALG1MW",167.27,SilverStone Technology,SST-ALG1MW,MicroATX Mid Tower,https://amazon.com/dp/B09M9FLWRK?tag=pcbuilder00-20
"CORSAIR CRYSTAL 280X RGB Micro-ATX Case, 2 RGB Fans, Lighting Node PRO included, Tempered Glass",179.99,CORSAIR,CRYSTAL 280X RGB,MicroATX Mid Tower,https://amazon.com/dp/B07CL9TCLN?tag=pcbuilder00-20
"Silverstone PS15 PRO, Micro-ATX Chassis, ARGB Fans, Tempered Glass",191.59,SilverStone Technology,SST-PS15B-PRO,MicroATX Mid Tower,https://amazon.com/dp/B08L8MWJ14?tag=pcbuilder00-20
"CORSAIR Crystal 280X Micro-ATX Case, Tempered Glass",200.17,Corsair,Crystal 280X,MicroATX Mid Tower,https://amazon.com/dp/B07CJTHWTK?tag=pcbuilder00-20
BitFenix Computer Case BFC-CLM-300-KKLS1-RP,230,BITFENIX,Colossus,MicroATX Mid Tower,https://amazon.com/dp/B00HRRJC58?tag=pcbuilder00-20
"Cooler Master NR400 Micro ATX PC/Gaming Case (1 x Window, 2 x Fans 120 mm)",278,Cooler Master,MasterBox NR400,MicroATX Mid Tower,https://amazon.com/dp/B07QP88F8B?tag=pcbuilder00-20
Silverstone SST-CS351 5 Bay SAS-12G / SATA-6G Hot Swappable High Performance NAS Case Black///White,366.13,SilverStone Technology,SST-CS351B,MicroATX Mid Tower,https://amazon.com/dp/B09VKJNYLW?tag=pcbuilder00-20
Thermaltake Versa H17 Black SPCC Micro ATX Mini Tower Gaming Computer Case,44.99,Thermaltake,Versa H17,MicroATX Mini Tower,https://amazon.com/dp/B0797GHT9F?tag=pcbuilder00-20
DIYPC DIY-F2-P SPCC MicroATX Mini Tower Computer Case,46.99,DIYPC,8541610603,MicroATX Mini Tower,https://amazon.com/dp/B01JMXKV04?tag=pcbuilder00-20
DIYPC USB 3.0 Micro-ATX Mini Tower Gaming Computer,46.99,DIYPC,DIY-F2-O,MicroATX Mini Tower,https://amazon.com/dp/B01JN7X1UQ?tag=pcbuilder00-20
Thermaltake Versa H18 Tempered Glass Black Spcc Micro ATX Gaming Computer Case CA-1J4-00S1WN-01,49.99,Thermaltake,CA-1J4-00S1WN-01,MicroATX Mini Tower,https://amazon.com/dp/B079G3TNDM?tag=pcbuilder00-20
DIYPC White SPCC Steel MicroATX Mini Tower Computer Case,49.99,DIYPC,F2 MicroATX,MicroATX Mini Tower,https://amazon.com/dp/B01JN1N620?tag=pcbuilder00-20
Diypc ARGB-Q3-Pink Cases Diypcargb-q3-pink R,53.44,DIYPC,ARGB-Q3-Pink,MicroATX Mini Tower,https://amazon.com/dp/B0CD6432X5?tag=pcbuilder00-20
Fractal Design Core 1100 - Mini Tower Computer Case - mATX - High Airflow And Cooling - 1x 120mm Silent Fan Included - Brushed Aluminium Front - Dust Filters,55,Fractal Design,Core 1100,MicroATX Mini Tower,https://amazon.com/dp/B00NPIL6GQ?tag=pcbuilder00-20
Fractal Design Focus G White Window,56.81,Fractal Design,Focus G,MicroATX Mini Tower,https://amazon.com/dp/B072JC4SCN?tag=pcbuilder00-20
COUGAR MG130-G Compact Micro-ATX Gaming Case with Glass Side Window,57,COUGAR,MG130-G,MicroATX Mini Tower,https://amazon.com/dp/B07Y5HZ9WM?tag=pcbuilder00-20
