Title,Price,Brand,Model,Cabinet Type,Link
Gamemax ContacCOCWP Case Gamemax Contac Coc Wp Rt,92.98,GAMEMAX,Gabinete Gamemax Contac Rosa e Branco,ATX Mid Tower,https://amazon.com/dp/B098VZKFPT?tag=pcbuilder00-20
"Antec DF700 Flux, Mid Tower Computer Case, ATX Gaming Case, USB3.0 x 2, 360 mm Radiator Support, 3 x 120 mm ARGB",93,Antec,DF700 FLUX,ATX Mid Tower,https://amazon.com/dp/B08PT8SRZG?tag=pcbuilder00-20
Fractal Design Pop Air RGB Black Tempered Glass Clear Tint,93,Fractal Design,FD-C-POR1A-06,ATX Mid Tower,https://amazon.com/dp/B08T1GB8D8?tag=pcbuilder00-20
"Rosewill ATX Mid Tower Gaming PC Computer Case with Blue LED Fans, 360mm AIO Water Cooling Radiator Support, 3 Sided Tempered Glass",93.09,Rosewill,CULLINAN MX-BLUE,ATX Mid Tower,https://amazon.com/dp/B01M6TV6PC?tag=pcbuilder00-20
DEEPCOOL Gamer Storm MACUBE 310 White ATX Mid Tower Case Full-Size Magnetic Tempered Glass Built-in Fan Hub and Graphics Card Holder,93.1,DEEP COOL,Storm MACUBE 310,ATX Mid Tower,https://amazon.com/dp/B07Z86CJP1?tag=pcbuilder00-20
Antec DP502 FLUX WHITE Cooling Middle Tower PC Case with Tempered Glass Panel,93.41,Antec,Phantom DP502 Flux,ATX Mid Tower,https://amazon.com/dp/B08PT8849G?tag=pcbuilder00-20
"Sharkoon VS8 RGB Midi ATX PC Case, White",93.45,Sharkoon,SHA-VS8 RGB WT,ATX Mid Tower,https://amazon.com/dp/B0CDPXZ43C?tag=pcbuilder00-20
"Sharkoon VS9 RGB Midi ATX PC Case, White",93.97,Sharkoon,S5624595,ATX Mid Tower,https://amazon.com/dp/B0CDQ2MDB8?tag=pcbuilder00-20
"DeepCool MATREXX 55 V3 ADD-RGB WH 3F Mid-Tower ATX Case, E-ATX Support, Tempered Glass Panels, Three Included ARGB Fans",94.83,DeepCool,MATREXX 55 V3 ADD-RGB WH 3F,ATX Mid Tower,https://amazon.com/dp/B07Z8T2BZN?tag=pcbuilder00-20
NZXT H5 Flow RGB Compact ATX Mid-Tower PC Gaming Case ??High Airflow Perforated Front Panel ??Tempered Glass Side Panel ??Cable Management ??2 x F140 RGB Core Fans ??280mm Radiator Support ??Black,94.99,NZXT,CC-H51FB-R1,ATX Mid Tower,https://amazon.com/dp/B0BQSJWFQM?tag=pcbuilder00-20
NZXT H5 Flow Compact ATX Mid-Tower PC Gaming Case ??High Airflow Perforated Front Panel ??Tempered Glass Side Panel,94.99,NZXT,CC-H51FW-01,ATX Mid Tower,https://amazon.com/dp/B0B6YHDB2Y?tag=pcbuilder00-20
NZXT H5 Flow Compact ATX Mid-Tower PC Gaming Case ??High Airflow Perforated Front Panel ??Tempered Glass Side Panel ??Cable Management,94.99,NZXT,CC-H51FB-01,ATX Mid Tower,https://amazon.com/dp/B0B6Y15C5L?tag=pcbuilder00-20
Corsair 4000D Tempered Glass Mid-Tower ATX PC Case - White,94.99,Corsair,CC-9011199-WW,ATX Mid Tower,https://amazon.com/dp/B08C7CJ8XZ?tag=pcbuilder00-20
"MUSETEX PC CASE ATX 6 PWM ARGB Fans Pre-Installed, Type-C Mid Tower Computer Case with Full View Dual Tempered Glass, Gaming PC Case,Black(K2)",94.99,MUSETEX,K2,ATX Mid Tower,https://amazon.com/dp/B0C9H87GPK?tag=pcbuilder00-20
Fractal Design Pop Air Black Solid,95,Fractal Design,FD-C-POA1A-01,ATX Mid Tower,https://amazon.com/dp/B08SRBTYGK?tag=pcbuilder00-20
"Antec Performance Series P20C ARGB, Massive Metal Mesh Front Panel, 3 x 120mm ARGB Fans & ARGB Hub, Type-C 3.2 Gen2 Ready, 2 x 360 mm Radiator Simultaneously, GPU Bracket, Mid-Tower E-ATX PC Case",95.15,Antec,CAA-P20C-ARGB,ATX Mid Tower,https://amazon.com/dp/B0BYGZCPW1?tag=pcbuilder00-20
"Cooler Master MasterBox 520 Mesh PC Case , Multiple Airflow Configurations, Mesh Front Panel & TG Side Panel, ARGB Controller",95.19,Cooler Master,MB520-WGNN-S00,ATX Mid Tower,https://amazon.com/dp/B0B31GC53C?tag=pcbuilder00-20
"Lian Li LancooL 216 Black Steel/Tempered Glass ATX Mid Tower Computer Case,2X 160 mm PWM Fans Included (Non-RGB)- LANCOOL 216X Black",95.99,Lian Li,LANCOOL 216-X,ATX Mid Tower,https://amazon.com/dp/B0BRP58KHT?tag=pcbuilder00-20
Elite 500 / Elite 500 ODD,96.57,Cooler Master,E500-KN5N-S00,ATX Mid Tower,https://amazon.com/dp/B09J547LH7?tag=pcbuilder00-20
"Antec NX Series-NX320, 3x120mm ARGB Fans Included,Tempered Glass Side Panel,1xUSB 3.0,360 mm Radiator Support, Mid Tower ATX Gaming Case, Black",96.91,Antec,NX320,ATX Mid Tower,https://amazon.com/dp/B09BQ1VGGM?tag=pcbuilder00-20
"Cougar Gaming Mid Tower Case Duoface Pro RGB Supporting 390mm Graphics Card with Controller, Four RGB Fans and Two Distinct Front Panels Included (Mesh and Tempered Glass) (Black)",97,COUGAR,CGR-5AD1B-RGB,ATX Mid Tower,https://amazon.com/dp/B0C4LB56CQ?tag=pcbuilder00-20
"Cougar Gaming Mid Tower Case Duoface Pro RGB Supporting 390mm Graphics Card with Controller, Four RGB Fans and Two Distinct Front Panels Included (Mesh and Tempered Glass) (White)",97,COUGAR,CGR-5AD1W-RGB,ATX Mid Tower,https://amazon.com/dp/B0C4LC41MT?tag=pcbuilder00-20
Fractal Design Meshify 2 Compact Lite Black TG Light Tint,97.05,Fractal Design,FD-C-MEL2C-03,ATX Mid Tower,https://amazon.com/dp/B093HJC1VM?tag=pcbuilder00-20
"Thermaltake Divider 370 TG ARGB Motherboard Sync E-ATX Mid Tower Computer Case with 3x120mm ARGB Fan Pre-Installed, CA-1S4-00M1WN-00",97.99,Thermaltake,CA-1S4-00M1WN-00,ATX Mid Tower,https://amazon.com/dp/B0B8X51PGK?tag=pcbuilder00-20
"Montech Sky Two, Dual Tempered Glass, 4X PWM ARGB Fans Pre-Installed, ATX Gaming Mid Tower Computer Case, Type C",97.99,Montech,SKY TWO (BLACK),ATX Mid Tower,https://amazon.com/dp/B0BNT962NF?tag=pcbuilder00-20
Thermaltake Versa N27 Shadow Blade ATX Gaming Mid Tower Computer Case with 3 Red LED Riing Fan Pre-installed,98.42,Thermaltake,Versa N27 Shadow Blade,ATX Mid Tower,https://amazon.com/dp/B07146XXBH?tag=pcbuilder00-20
"Cooler Master HAF 500 White High Airflow ATX Mid-Tower, Mesh Front Panel, Dual 200mm Customizable ARG Lighting Fans, Rotatable GPU Fan, USB 3.2 Gen 2 Type C and Tempered Glass (H500-WGNN-S00)",98.67,Cooler Master,H500-WGNN-S00,ATX Mid Tower,https://amazon.com/dp/B09J5CRF7S?tag=pcbuilder00-20
"Geometric Future M4 Caliburn mid/Mini Tower, E-ATX/ATX Gaming Case, Glass/ 1.2mm Steel, Vertical Air Tunnel Design, Type C, 360/240 Radiator, Vertical GPU Mount, GEO-M4-CAL (PC Case ONLY)",99,Geometric Future,GEO-M4-CAL,ATX Mid Tower,https://amazon.com/dp/B0CFFGS636?tag=pcbuilder00-20
"Cooler Master MasterBox MB530P ATX Mid-Tower with Three Tempered Glass Panel, Three 120mm ARGB Fans, Front Side Mesh Intakes",99.85,Cooler Master,MasterBox MB530P,ATX Mid Tower,https://amazon.com/dp/B07G5M7P4C?tag=pcbuilder00-20
Fractal Design Define 7 Compact White Brushed Aluminum/Steel ATX Compact Silent Tempered Glass Window Mid Tower Computer Case,99.85,Fractal Design,Define 7,ATX Mid Tower,https://amazon.com/dp/B0877K5FNN?tag=pcbuilder00-20
NZXT H6 Flow | CC-H61FB-01 | Compact Dual-Chamber Mid-Tower Airflow Case | Panoramic Glass Panels | High-Performance Airflow Panels | Includes 3 x 120mm Fans | Cable Management | Black,99.99,NZXT,CC-H61FB-01,ATX Mid Tower,https://amazon.com/dp/B0C89FCDFP?tag=pcbuilder00-20
NZXT H6 Flow | CC-H61FW-01 | Compact Dual-Chamber Mid-Tower Airflow Case | Panoramic Glass Panels | High-Performance Airflow Panels | Includes 3 x 120mm Fans | Cable Management | White,99.99,NZXT,CC-H61FW-01,ATX Mid Tower,https://amazon.com/dp/B0C89G9QDK?tag=pcbuilder00-20
NZXT H510 Elite Premium Mid-Tower ATX Case PC Gaming Case - Dual-Tempered Glass Panel - Front I/O USB Type-C Port - Vertical GPU Mount - Integrated RGB Lighting,99.99,NZXT,H510 Elite,ATX Mid Tower,https://amazon.com/dp/B07T7L875Z?tag=pcbuilder00-20
NZXT H510 Elite - CA-H510E-B1 - Premium Mid-Tower ATX Case PC Gaming Case - Dual-Tempered Glass Panel - Front I/O USB Type-C Port - Vertical GPU Mount - Integrated RGB Lighting,99.99,NZXT,H510 Elite,ATX Mid Tower,https://amazon.com/dp/B07TD9VTVQ?tag=pcbuilder00-20
Corsair iCUE 220T RGB Airflow Tempered Glass Mid-Tower Smart Case,99.99,Corsair,iCUE 220T RGB,ATX Mid Tower,https://amazon.com/dp/B07RW8GLQJ?tag=pcbuilder00-20
"Cooler Master MasterCase H500 ARGB Airflow ATX Mid-Tower with Mesh & Transparent Front Panel Option, Dual 200mm ARGB Fans, Tempered Glass & ARGB Lighting System",99.99,Cooler Master,MasterCase H500,ATX Mid Tower,https://amazon.com/dp/B07DRVHBWK?tag=pcbuilder00-20
"MUSETEX 6pcs 120mm ARGB Fans and USB3.0 ATX Mid-Tower Chassis Gaming PC Case, 2 Tempered Glass Panels Gaming Style Windows Computer Case Desktop Case",99.99,MUSETEX,Phantom,ATX Mid Tower,https://amazon.com/dp/B07MDFYW3N?tag=pcbuilder00-20
MSI MPG Velox 100R - Mid-Tower Gaming PC Case - Tempered Glass Side Panel - 4 x 120mm ARGB Fans - Liquid Cooling Support up to 360mm Radiator - Mesh Panel for Optimized Airflow,99.99,MSI,MPG VELOX 100R,ATX Mid Tower,https://amazon.com/dp/B09HRQQ18B?tag=pcbuilder00-20
MSI MPG GUNGNIR 110R - Premium Mid-Tower Gaming PC Case - Tempered Glass Side Panel - 4 x ARGB 120mm Fans,99.99,MSI,14977733,ATX Mid Tower,https://amazon.com/dp/B0899H96NQ?tag=pcbuilder00-20
"Phanteks Eclipse P400A ATX Mid-tower (PH-EC400ATG_BK01), Mesh Front Panel, Tempered Glass, Fan Controller",99.99,Phanteks,Eclipse P400A,ATX Mid Tower,https://amazon.com/dp/B07TYR1P1G?tag=pcbuilder00-20
Antec Mid-Tower Case with 2X USB 3.0 Ports Durable Steel Bottom & Front Side Vents Case,99.99,Antec,VSK4000E-U3,ATX Mid Tower,https://amazon.com/dp/B00CY9TMFO?tag=pcbuilder00-20
"Lian Li Lancool 216 RGB Black Steel/Tempered Glass ATX Mid Tower Computer Case,2X 160 mm ARGB Fans Included - LANCOOL 216RX Black",99.99,Lian Li,LANCOOL 216R-X,ATX Mid Tower,https://amazon.com/dp/B0BN3SY5XW?tag=pcbuilder00-20
"Lian Li Lancool 216 RGB White Steel/Tempered Glass ATX Mid Tower Computer Case,2X 160 mm ARGB Fans Included - LANCOOL 216RW White",99.99,Lian Li,LANCOOL 216R-W,ATX Mid Tower,https://amazon.com/dp/B0BN3TTBKM?tag=pcbuilder00-20
DeepCool Matrexx 50 Black Case ATX USB 3.0 PC Gaming 0.6 mm SPCC with 4 Fans 120 mm PWM RGB Rainbow Addressable 5V ADD Front,99.99,DeepCool,MATREXX 50 ADD-RGB 4F,ATX Mid Tower,https://amazon.com/dp/B07X8Q1V9H?tag=pcbuilder00-20
"Phanteks (PH-EC360ATG_DBK02) Eclipse G360A Ultra-fine Performance Mesh, Mid-Tower Gaming case, Tempered Glass, Digital-RGB Lighting, Black",99.99,Phanteks,PH-EC360ATG_DBK02,ATX Mid Tower,https://amazon.com/dp/B0B3D2Z1C3?tag=pcbuilder00-20
"Thermaltake Divider 370 TG ARGB Motherboard Sync E-ATX Mid Tower Computer Case with 3x120mm ARGB Fan Pre-Installed, Ventilated Front Mesh Panel",99.99,Thermaltake,CA-1S4-00M6WN-00,ATX Mid Tower,https://amazon.com/dp/B0B8X5HY8J?tag=pcbuilder00-20
"GIGABYTE C301 Glass - Black Mid Tower PC Gaming Case, Tempered Glass, USB Type-C, 4X ARBG Fans Included (GB-C301G)",99.99,GIGABYTE,GB-C301G,ATX Mid Tower,https://amazon.com/dp/B0BXMWXK3N?tag=pcbuilder00-20
XPG STARKER Compact Mid-Tower ATX RGB Effect Efficient Airflow Tempered Glass PC Case,99.99,XPG,STARKER-WHCWW,ATX Mid Tower,https://amazon.com/dp/B08SW2VS2J?tag=pcbuilder00-20
"Phanteks NV5 (PH-NV523TG_DBK01) Showcase Mid-Tower Chassis, High Airflow Performance, Integrated D/A-RGB Lighting, Seamless Tempered Glass Design, 8 Fan Positions, Black",99.99,Phanteks,PH-NV523TG_DBK01,ATX Mid Tower,https://amazon.com/dp/B0CJZ5QY35?tag=pcbuilder00-20
"Antec DP503 ATX Mid Tower PC Case, Type-C Gen2, 3 x 120mm ARGB Fans with ARGB & PWM Controller, Up to 2 x 360mm Radiator",99.99,Antec,0-761345-810777,ATX Mid Tower,https://amazon.com/dp/B0B3MF2JL2?tag=pcbuilder00-20
"Montech Sky Two, Dual Tempered Glass, 4X PWM ARGB Fans Pre-Installed, ATX Gaming Mid Tower Computer Case",99.99,Montech,SKY TWO (WHITE),ATX Mid Tower,https://amazon.com/dp/B0BNTM5W5P?tag=pcbuilder00-20
Vetroo AL700 Mid-Tower ATX White PC Case Dual Tempered Glass Panel Top & Side 360mm Radiator Support Computer Gaming Case ARGB with LED Strip Pre-Installed Rear 120mm Addressable RGB Fans,99.99,Vetroo,AL700 White,ATX Mid Tower,https://amazon.com/dp/B0BWQQMML7?tag=pcbuilder00-20
"AZZA CSAZ-460A Octane A ATX Mid Tower Gaming Case, Black",99.99,AZZA,CSAZ-460A OCTANE A,ATX Mid Tower,https://amazon.com/dp/B093LNX3BX?tag=pcbuilder00-20
Fractal Design Define 7 Compact Brushed Aluminum / Steel ATX Compact Silent Tempered Glass Window Mid Tower Computer Case,100,Fractal Design,Define 7,ATX Mid Tower,https://amazon.com/dp/B08146T59S?tag=pcbuilder00-20
Fractal Design Define 7 Compact Black Brushed Aluminum/Steel ATX Compact Silent Mid Tower Computer,100,Fractal Design,Define 7,ATX Mid Tower,https://amazon.com/dp/B08146YTWY?tag=pcbuilder00-20
SilverStone Technology ATX Tower Computer Case with 120mm Exhaust Fan in Black and Red with Side Panel Window,100.24,SilverStone Technology,RL06BR-W,ATX Mid Tower,https://amazon.com/dp/B071SKLJ69?tag=pcbuilder00-20
"be quiet! Pure Base 500 Gray, ATX, Midi Tower Computer Case, Two Preinstalled Fans",100.49,be quiet!,Pure Base 500,ATX Mid Tower,https://amazon.com/dp/B07TVL77L8?tag=pcbuilder00-20
Thermaltake H200 Tempered Glass RGB Light Strip ATX Mid Tower Case with One 120mm Rear Fan Pre-Installed,100.49,Thermaltake,H200,ATX Mid Tower,https://amazon.com/dp/B07SNGYFYY?tag=pcbuilder00-20
DEEP COOL CL500 Mid-Tower ATX Case High Airflow Mesh Front Panel I/O USB Type-C Port Tempered Glass Magnetic Side Panel Built-in Fan,101.57,DEEP COOL,CL500,ATX Mid Tower,https://amazon.com/dp/B08DHP66KJ?tag=pcbuilder00-20
"Cooler Master MasterBox MB500 ATX Mid-Tower with Three 120mm RGB Fans, Front Semi-Meshed Ventilation, Tempered Glass Side Panel",101.59,Cooler Master,MasterBox MB500,ATX Mid Tower,https://amazon.com/dp/B078BDMZ1Y?tag=pcbuilder00-20
"be quiet! Pure Base 500 Window WHITE, ATX, midi tower computer case, tempered glass window, two preinstalled fans",101.72,be quiet!,Pure Base 500,ATX Mid Tower,https://amazon.com/dp/B07TYQTTYQ?tag=pcbuilder00-20
"be quiet! Pure Base 500 Window GRAY, ATX, midi tower computer case, tempered glass window, two preinstalled fans",101.72,be quiet!,Pure Base 500,ATX Mid Tower,https://amazon.com/dp/B07TYQ1B6B?tag=pcbuilder00-20
Cooler Master MasterBox MB600L V2 with ODD - Minimalistic ATX PC Case with Mesh Intakes & Brushed Front Panel,102.72,Cooler Master,MB600L2-KN5N-S00,ATX Mid Tower,https://amazon.com/dp/B08XQKZS9T?tag=pcbuilder00-20
Fractal Design Meshify C - Compact Computer Case - High Performance Airflow/Cooling - 2X Fans Included - PSU Shroud - Modular Interior - Water-Cooling Ready - USB3.0 - Tempered Glass Light,104,Fractal Design,Meshify C,ATX Mid Tower,https://amazon.com/dp/B07B3JDBM2?tag=pcbuilder00-20
"be quiet! BG034 Pure Base 500 Black, ATX, Midi Tower Computer Case, Two Preinstalled Fans",104.11,be quiet!,Pure Base 500,ATX Mid Tower,https://amazon.com/dp/B07TSG8D54?tag=pcbuilder00-20
DeepCool CK560 PC Case ATX High-Airflow Front Panel with 3pcs 120mm ARGB Fans Mid-Tower Gaming Case,104.37,DeepCool,CK560,ATX Mid Tower,https://amazon.com/dp/B09MNDCY59?tag=pcbuilder00-20
"Antec Dark League DF800 Flux White, Flux Platform, 5 x 120 mm Fans Included, ARGB , Mid-Tower ATX Gaming Case",104.42,Antec,0-761345-80084-6,ATX Mid Tower,https://amazon.com/dp/B0B3CQ48HQ?tag=pcbuilder00-20
Thermaltake Ceres 300 Matcha Green/Mid Tower E-ATX Computer Case with Tempered Glass Side Panel/ 2xCT140 ARGB Fan Preinstalled/Rotational PCIe Slots/ 3 Years Warranty,104.53,Thermaltake,CA-1Y2-00MEWN-00,ATX Mid Tower,https://amazon.com/dp/B0CBVNGPD5?tag=pcbuilder00-20
NZXT H510i - CA-H510i-BR - Compact ATX Mid-Tower PC Gaming Case - Front I/O USB Type-C Port - Vertical GPU Mount - Tempered Glass Side Panel,104.86,NZXT,H510i,ATX Mid Tower,https://amazon.com/dp/B07T81N1LL?tag=pcbuilder00-20
"MUSETEX ATX PC Case with 6 Pcs 120mm ARGB Fans, Computer Gaming Case Mid-Tower Phantom Black",104.99,MUSETEX,G06MN6-B,ATX Mid Tower,https://amazon.com/dp/B07QKV6HP9?tag=pcbuilder00-20
"Antec Dark League DF700 Flux White, Mid Tower ATX Gaming Case, Flux Platform",104.99,Antec,0-761345-80074-7,ATX Mid Tower,https://amazon.com/dp/B0B3HKNK3T?tag=pcbuilder00-20
"Antec Dark League DF800 Flux, Flux Platform, 5 x 120 mm Fans Included, ARGB & PWM Fan Controller, Tempered Glass Side Panel, Black",104.99,Antec,0-761345-80081-5,ATX Mid Tower,https://amazon.com/dp/B09RJMD6JG?tag=pcbuilder00-20
DeepCool CH560 WH White PC Case High-Airflow 140mm PWM ARGB Fans Front Mid-Tower ATX PC Case Hybrid Mesh/Tempered Glass Side Panel 360mm Radiator Top/Front Support Gaming Case USB 3.0 Type-C I/O Panel,104.99,DeepCool,CH560 WH,ATX Mid Tower,https://amazon.com/dp/B0C3GJYRL8?tag=pcbuilder00-20
"Antec Dark League DP505 White, High-Airflow Mesh Front Panel, 3 x 120mm ARGB Fans, 8 x Rubber Grommets & 3 x Cable Ties, Mid-Tower E-ATX Gaming Case",104.99,Antec,DP505 White,ATX Mid Tower,https://amazon.com/dp/B0B4DDFGK4?tag=pcbuilder00-20
Fractal Design Meshify 2 Compact Lite RGB Black TG Light Tint,105.99,Fractal Design,FD-C-MEL2C-05,ATX Mid Tower,https://amazon.com/dp/B093HKL613?tag=pcbuilder00-20
"DeepCool CH510 MESH DIGITALMid-Tower ATX Computer Case, Digital LCD Display for CPU/GPU Temps, Black",106.22,DeepCool,CH510 MESH  DIGITAL,ATX Mid Tower,https://amazon.com/dp/B0BJ8TV3D7?tag=pcbuilder00-20
Fractal Design Pop Air RGB Cyan Core Tempered Glass Clear Tint,106.45,Fractal Design,FD-C-POR1A-02,ATX Mid Tower,https://amazon.com/dp/B08KTMB9N7?tag=pcbuilder00-20
XPG Defender Pro Mid-Tower ATX MESH Front Panel RGB Effect Efficient Airflow Tempered Glass PC Case,106.48,XPG,DEFENDER PRO-WHCWW,ATX Mid Tower,https://amazon.com/dp/B08SVX6RH3?tag=pcbuilder00-20
"Silverstone FARA R1 PRO, Tempered Glass, mid Tower ATX Chassis with ARGB",106.96,SilverStone Technology,FARA R1 PRO,ATX Mid Tower,https://amazon.com/dp/B08KZ586CQ?tag=pcbuilder00-20
"MagniumGear (MG-NE620Q_DWT02) NEO Qube 2, Dual Chamber ATX Mid-Tower, Digital-RGB Lighting, Front I/O USB Type C, Tempered Glass Panels, White",107,Phanteks,MG-NE620Q_DWT02,ATX Mid Tower,https://amazon.com/dp/B07YFQ559Z?tag=pcbuilder00-20
Corsair iCUE 220T RGB Airflow Tempered Glass Mid-Tower Smart Case,107.69,Corsair,iCUE 220T RGB,ATX Mid Tower,https://amazon.com/dp/B07RQW7W9P?tag=pcbuilder00-20
Thermaltake Ceres CA-1Y2-00M1WN-00 CS8724 300 TG ARGB Black E-ATX Motherboard Air Flow Oriented Middle Tower PC Case,107.82,Thermaltake,CA-1Y2-00M1WN-00,ATX Mid Tower,https://amazon.com/dp/B0C3B23MVP?tag=pcbuilder00-20
DEEPCOOL Gamer Storm MACUBE 310 Black ATX Mid Tower Case Full-Size Magnetic Tempered Glass Built-in Fan Hub and Graphics Card Holder,107.84,DeepCool,MACUBE 310 BK,ATX Mid Tower,https://amazon.com/dp/B07Z87BBKB?tag=pcbuilder00-20
"Antec Dark Fleet DF600 Flux, Mid Tower ATX Gaming Case, F-LUX Platform, Tempered Glass Side Panel, USB3.0 x 2, 360 mm Radiator Support, 3 x 120 mm ARGB",107.85,Antec,DF600 FLUX,ATX Mid Tower,https://amazon.com/dp/B08DHKF7QK?tag=pcbuilder00-20
"InWin A5 ATX IW-CS-A5BLK-1AM120S Gaming Chassis, Side Panel - Water Cooling Ready - Mercury 120mm ARGB Rear Fan",109,IN WIN,IW-CS-A5BLK-1AM120S,ATX Mid Tower,https://amazon.com/dp/B0BF2GDPDZ?tag=pcbuilder00-20
"SilverStone Technology FARA 512Z High Airflow ATX Mid-Tower Chassis with Dual Radiator Support & ARGB Lighting, SST-FA512Z-BG",109.07,SilverStone Technology,SST-FA512Z-BG,ATX Mid Tower,https://amazon.com/dp/B0BJ6J86NW?tag=pcbuilder00-20
"Cooler Master MasterBox TD500 Mesh White Airflow ATX Mid-Tower with Polygonal Mesh Front Panel, Crystalline Tempered Glass, E-ATX up to 10.5"", Three 120mm ARGB Fans & ARGB Lighting System",109.31,Cooler Master,MasterBox TD500,ATX Mid Tower,https://amazon.com/dp/B08412JPCH?tag=pcbuilder00-20
"Cooler Master MasterBox TD500 Mesh V2 - E-ATX Mid-Tower PC Case with Tessellated Mesh, 3 x 120mm Pre-Installed ARGB Fans, Removable Top Panel, Tempered Glass Side Panel, USB Type-C 10Gbps - White",109.61,Cooler Master,TD500V2-WGNN-S00,ATX Mid Tower,https://amazon.com/dp/B0BN4779ZH?tag=pcbuilder00-20
"Zalman Z9 Neo Plus ATX Computer/PC Case with 2 x120mm Fan Included(Front), 1x 120mm Blue LED Fan Included (Rear) 2 x 120mm Blue LED Fan Included - White",109.9,Zalman,Z9 Neo,ATX Mid Tower,https://amazon.com/dp/B075YD4C8X?tag=pcbuilder00-20
"Cooler Master MasterBox Pro 5 ARGB ATX Mid-Tower with Adaptable Layout E-ATX up to 10.5"", DarkMirror Front Panel, Three 120mm ARGB Lighting Fans",109.99,Cooler Master,MCY-B5P2-KWGN-03,ATX Mid Tower,https://amazon.com/dp/B08B47BWG2?tag=pcbuilder00-20
"LIAN LI High Airflow ATX PC Case, RGB, Mesh Front Panel Mid-Tower Chassis w/ 3 ARGB PWM Fans Pre-Installed",109.99,Lian Li,G99.OE764CX.00AM,ATX Mid Tower,https://amazon.com/dp/B0B5THCD6R?tag=pcbuilder00-20
"Phanteks Eclipse P400A Digital ATX Mid-Tower , Mesh Front Panel, Tempered Glass, Digital-RGB",109.99,Phanteks,Eclipse P400A,ATX Mid Tower,https://amazon.com/dp/B07TTDW37F?tag=pcbuilder00-20
"Vetroo AL600 Mid-Tower ATX PC Case, Top 360mm Radiator Support, 3x120mm ARGB Fans, 3x120mm Regular Fans, Airflow Mesh White Gaming Case w/Controller Hub",109.99,Vetroo,VT-CASE-AL600-WT,ATX Mid Tower,https://amazon.com/dp/B0B1735TMK?tag=pcbuilder00-20
"Vetroo AL600 Black Mid-Tower ATX PC Case, Pre-Installed 3x120mm ARGB Fans, 3x120mm Regular Fans",109.99,Vetroo,VT-CASE-AL600-BK,ATX Mid Tower,https://amazon.com/dp/B0B17SW9G8?tag=pcbuilder00-20
"Vetroo AL600 Pink Mid-Tower ATX PC Case, Pre-Installed 3x120mm ARGB Fans, 3x120mm Regular Fans, Top 360mm Radiator Support High-Airflow Computer Gaming Case with Controller Hub",109.99,Vetroo,AL600,ATX Mid Tower,https://amazon.com/dp/B0B17M3F9D?tag=pcbuilder00-20
"Antec Dark Phantom DP502 FLUX, Mid Tower ATX Gaming Case, Tempered Glass Side Panel, Swing Open Front Panel & LED Strips, F-LUX Platform",109.99,Antec,Phantom DP502 Flux,ATX Mid Tower,https://amazon.com/dp/B08J3Z946V?tag=pcbuilder00-20
"Phanteks (PH-EC360ATG_DMW02) Eclipse G360A Ultra-fine Performance Mesh, Mid-Tower Gaming case",109.99,Phanteks,PH-EC360ATG_DMW02,ATX Mid Tower,https://amazon.com/dp/B0B3D4GJLC?tag=pcbuilder00-20
DeepCool CH560 ATX PC Case High-Airflow 140mm PWM ARGB Fans Front Panel Mid-Tower Chassis Hybrid Mesh/Tempered Glass Side Panel 360mm Radiator Top/Front Support Gaming Case USB 3.0 Type-C I/O Panel,109.99,DeepCool,CH560,ATX Mid Tower,https://amazon.com/dp/B0C3GHHN6N?tag=pcbuilder00-20
"Phanteks Eclipse G500A Mid Tower Case, Fanless, DRGB, Black",109.99,Phanteks,PH-EC500GA_DBK01B,ATX Mid Tower,https://amazon.com/dp/B0BMPB193W?tag=pcbuilder00-20
"GIGABYTE C301 Glass White - White Mid Tower PC Gaming Case, Tempered Glass, USB Type-C, 4X ARBG Fans Included (GB-C301GW)",109.99,GIGABYTE,GB-C301GW,ATX Mid Tower,https://amazon.com/dp/B0BXMWBTPD?tag=pcbuilder00-20
XPG Defender Pro Mid-Tower ATX MESH Front Panel RGB Effect Efficient Airflow Tempered Glass PC Case,109.99,XPG,DEFENDER PRO-BKCWW,ATX Mid Tower,https://amazon.com/dp/B08SVTYJRZ?tag=pcbuilder00-20
Fractal Design Define 7 Compact Black Brushed Aluminum/Steel ATX Compact Silent Dark Tinted Tempered Glass Window Mid Tower Computer Case,109.99,Fractal Design,Define 7 Compact,ATX Mid Tower,https://amazon.com/dp/B08146Z5CG?tag=pcbuilder00-20
"Montech Sky Two, Dual Tempered Glass, 4X PWM ARGB Fans Pre-Installed, ATX Gaming Mid Tower Computer Case",109.99,Montech,SKY TWO (BLUE),ATX Mid Tower,https://amazon.com/dp/B0BNTVKDLK?tag=pcbuilder00-20
"AZZA AERO Black, CSAZ-480, ATX Computer Case, Metal Mesh Side Panel, 4 x 120 mm ARGB & PWM Fans Included",109.99,AZZA,CSAZ-480 AERO,ATX Mid Tower,https://amazon.com/dp/B0B5X52FR9?tag=pcbuilder00-20
"AZZA LEGIONAIRE Black, CSAZ-470, ATX Computer Case, Metal Mesh Side Panel, 4 x 120 mm ARGB & PWM Fans Included",109.99,AZZA,CSAZ-470 LEGIONAIRE,ATX Mid Tower,https://amazon.com/dp/B0B62RSR3B?tag=pcbuilder00-20
"Phanteks NV5 (PH-NV523TG_DMW01) Showcase Mid-Tower Chassis, High Airflow Performance, Integrated D/A-RGB Lighting, Seamless Tempered Glass Design, 8 Fan Positions, White",109.99,Phanteks,PH-NV523TG_DMW01,ATX Mid Tower,https://amazon.com/dp/B0CJW7BDMH?tag=pcbuilder00-20
"Aerocool SHARD Mid-Tower RGB PC Gaming case, ATX, Full Acrylic Side Panel, RGB LED Strip Included, 13 Lighting Modes, 1 x 120mm Fan Included, The Missing Piece",110.8,AeroCool,SHARD,ATX Mid Tower,https://amazon.com/dp/B07KQXG3S7?tag=pcbuilder00-20
ANTEC P10C Quiet Middle Tower PC Case with Soundproofing Panel,110.85,Antec,0-761345-80102-7,ATX Mid Tower,https://amazon.com/dp/B0B2JML3KN?tag=pcbuilder00-20
"Thermaltake Core P3 ATX Tempered Glass Gaming Computer Case Chassis, Open Frame Panoramic Viewing",110.87,Thermaltake,Core P3 TG Snow Edition,ATX Mid Tower,https://amazon.com/dp/B07BFGYLJZ?tag=pcbuilder00-20
"Cooler Master Silencio S600 Midi Tower ATX Case, Glasfenster, Schallgedämmt",111.7,Cooler Master,Silencio S600,ATX Mid Tower,https://amazon.com/dp/B07T479T7M?tag=pcbuilder00-20
"Lian Li Mid-Tower Chassis ATX Computer Case PC Gaming Case w/Tempered Glass Side Panel, Magnetic Dust Filter,Water-Cooling Ready, Side Ventilation and 2x120mm Fan Pre-Installed",111.75,Lian Li,LANCOOL 205,ATX Mid Tower,https://amazon.com/dp/B085DPLBM6?tag=pcbuilder00-20
"GAMDIAS Gaming ATX Mid Tower Gaming Computer PC Case with Tempered Glass and ARGB LED Strip, RGB Motherboard Sync",112.39,ZEUS GAMDIAS,GD-ARGUS M1(EPE),ATX Mid Tower,https://amazon.com/dp/B07VRKTWCC?tag=pcbuilder00-20
Fractal Design Meshify 2 Compact White ATX Flexible High-Airflow Tempered Glass Window Mid Tower Computer Case,113,Fractal Design,FD-C-MES2C-05,ATX Mid Tower,https://amazon.com/dp/B0822Y6KYP?tag=pcbuilder00-20
"be quiet! Pure Base 600 Window, Mid-Tower ATX, 2 Pre-Installed Fans, Tempered Glass Window",113.82,be quiet!,Pure Base 600,ATX Mid Tower,https://amazon.com/dp/B06WVN7T6K?tag=pcbuilder00-20
"be quiet! Pure Base 600 Window Black, BGW21, Mid-Tower ATX, 2 Pre-Installed Fans, Tempered Glass Window",113.82,be quiet!,Pure Base 600,ATX Mid Tower,https://amazon.com/dp/B06WVRDC41?tag=pcbuilder00-20
SilverStone Technology FAR1W-PRO Tempered Glass Mid Tower ATX Case with ARGB,113.87,SilverStone Technology,SST-FAR1W-PRO,ATX Mid Tower,https://amazon.com/dp/B0973VP7V1?tag=pcbuilder00-20
Thermaltake Commander G33 TG ARGB Mid-Tower,114.85,Thermaltake,CA-1P3-00M1WN-00,ATX Mid Tower,https://amazon.com/dp/B084QNCPTQ?tag=pcbuilder00-20
Corsair 3000D RGB Airflow Mid-Tower PC Case ??3X AR120 RGB Fans ??Three-Slot GPU Support ??Fits up to 8X 120mm Fans ??High-Airflow Design ??Black,114.99,Corsair,CC-9011255-WW,ATX Mid Tower,https://amazon.com/dp/B0C2JMTX2J?tag=pcbuilder00-20
