Title,Price,Brand,Model,Cabinet Type,Link
"Geometric Future M8 Lohan Black Mid Tower E-ATX/ATX Gaming Case, 4mm Glass/ 1.0 mm Steel, Vertical Air Tunnel Design, Support, 420/360 Radiator, Vertical GPU Mount, GEO-M8-LOB (PC Case ONLY)",149.9,Geometric Future,Model 8,ATX Mid Tower,https://amazon.com/dp/B09SG9664K?tag=pcbuilder00-20
be quiet! Shadow Base 800 DX - ARGB - Mid-Tower PC Gaming Case - 420mm radiators or E-ATX motherboards Support - Black - BGW61,149.9,be quiet!,BGW61,ATX Mid Tower,https://amazon.com/dp/B0C58VGLGK?tag=pcbuilder00-20
"APNX C1 Mid-Tower ATX Black PC Case, 4 Included High Airflow APNX FP1 ARGB Fans, up to 11 Total Fan Slots, Top and Side 360mm Liquid Cooler Support, 5-Port PWM ARGB Control Hub",149.9,APNX,APCM-CR01043.11,ATX Mid Tower,https://amazon.com/dp/B0CHMRKVZ5?tag=pcbuilder00-20
"be quiet! Pure Base 500 FX Black, Mid Tower ATX case, ARGB, 4 pre-Installed Light Wings PWM Fans, Tempered Glass Window - BGW43",149.92,be quiet!,BGW43,ATX Mid Tower,https://amazon.com/dp/B0B832WB3R?tag=pcbuilder00-20
HYTE Y40 Modern Aesthetic Panoramic Tempered Glass Mid-Tower ATX Computer Gaming Case with PCIE 4.0 Riser Cable Included,149.99,HYTE,CS-HYTE-Y40-B,ATX Mid Tower,https://amazon.com/dp/B0BQPLV7M6?tag=pcbuilder00-20
HYTE Y40 Modern Aesthetic Panoramic Tempered Glass Mid-Tower ATX Computer Gaming Case,149.99,HYTE,CS-HYTE-Y40-BW,ATX Mid Tower,https://amazon.com/dp/B0BQP93GYX?tag=pcbuilder00-20
Fractal Design North Charcoal Black Tempered Glass Dark - Genuine Walnut Wood Front - Glass Side Panel - Two 140mm Aspect PWM Fans Included - Type C USB - ATX Airflow Mid Tower PC Gaming Case,149.99,Fractal Design,FD-C-NOR1C-02,ATX Mid Tower,https://amazon.com/dp/B09V8HNWW9?tag=pcbuilder00-20
ADATA XPG Battle Cruiser Mid-Tower 4 RGB Fans Tempered Glass Panel PC Case,149.99,ADATA,XPG Battle Cruiser,ATX Mid Tower,https://amazon.com/dp/B07ZNR16G1?tag=pcbuilder00-20
ADATA XPG Battle Cruiser Mid-Tower 4 RGB Fans Tempered Glass Panel PC Case,149.99,ADATA,XPG Battle Cruiser,ATX Mid Tower,https://amazon.com/dp/B07ZNQGP5N?tag=pcbuilder00-20
Thermaltake Ceres 500 Snow Edition Mid Tower E-ATX Computer Case with Tempered Glass Side Panel,149.99,Thermaltake,CA-1X5-00M6WN-00,ATX Mid Tower,https://amazon.com/dp/B0BRNXHFMC?tag=pcbuilder00-20
Thermaltake Ceres 500 Black Mid Tower E-ATX Computer Case with Tempered Glass Side Panel; 4 Preinstalled PWM ARGB Fans,149.99,Thermaltake,CA-1X5-00M1WN-00,ATX Mid Tower,https://amazon.com/dp/B0BRNX4B5Q?tag=pcbuilder00-20
"Phanteks Eclipse G500A Performance Mid Tower Case, Black",149.99,Phanteks,PH-EC500GA_BBK01,ATX Mid Tower,https://amazon.com/dp/B0BMPPSP5M?tag=pcbuilder00-20
"Cooler Master Box Lite 5 RGB ATX Mid-Tower w/ Front DarkMirror Panel, 3 Customize Color Trims, Tempered Glass Side Panel & 3x 120mm",151.4,Cooler Master,Box Lite 5 RGB,ATX Mid Tower,https://amazon.com/dp/B075N2898D?tag=pcbuilder00-20
Fractal Design North Charcoal Black,152.99,Fractal Design,FD-C-NOR1C-01,ATX Mid Tower,https://amazon.com/dp/B09V878FXQ?tag=pcbuilder00-20
Fractal Design Define 7 Black Brushed Aluminum/Steel E-ATX Silent Modular Mid Tower Computer Case,153.49,Fractal Design,Define 7 Black,ATX Mid Tower,https://amazon.com/dp/B08146JLXK?tag=pcbuilder00-20
"Thermaltake Core P3 ATX Tempered Glass Gaming Computer Case Chassis, Open Frame Panoramic Viewing, Glass Wall-Mount",153.99,Thermaltake,Core P3,ATX Mid Tower,https://amazon.com/dp/B07BVZN3PV?tag=pcbuilder00-20
Lian Li Lancool III RGB - mid Tower - Extended ATX,154.8,Lian Li,LANCOOL III RGB,ATX Mid Tower,https://amazon.com/dp/B0B9WF5FW1?tag=pcbuilder00-20
be quiet! Shadow Base 800 DX -ARGB - Mid-Tower PC Gaming Case - 420mm radiators or E-ATX motherboards Support -White - BGW62,154.9,be quiet!,BGW62,ATX Mid Tower,https://amazon.com/dp/B0C593T9S7?tag=pcbuilder00-20
"be quiet! Silent Base 601 Black Mid-Tower ATX Computer Case, two 140mm fans, 10mm extra thick insulation mats",154.98,be quiet!,Silent Base 601,ATX Mid Tower,https://amazon.com/dp/B07GT4G988?tag=pcbuilder00-20
"be quiet! Silent Base 601 Silver Mid-Tower ATX Computer Case, two 140mm fans, 10mm extra thick insulation mats",154.98,be quiet!,Silent Base 601,ATX Mid Tower,https://amazon.com/dp/B07GT5HD1Y?tag=pcbuilder00-20
"ASUS TUF Gaming GT502 White ATX Mid-Tower Computer Case,Front Panel RGB Button,USB 3.2 Type-C,2x USB 3.0 Ports",154.99,ASUS,GT502/WHT/TG//,ATX Mid Tower,https://amazon.com/dp/B0BQD5J39S?tag=pcbuilder00-20
"APNX C1 Mid-Tower ATX White PC Case, 4 Included High Airflow APNX FP1 ARGB Fans, up to 11 Total Fan Slots, Top and Side 360mm Liquid Cooler Support, 5-Port PWM ARGB Control Hub",155.9,APNX,APCM-CR01043.21,ATX Mid Tower,https://amazon.com/dp/B0CHMTRFLQ?tag=pcbuilder00-20
Fractal Design Torrent Compact RGB White TG Clear Tint,156.63,Fractal Design,FD-C-TOR1C-05,ATX Mid Tower,https://amazon.com/dp/B09XR59886?tag=pcbuilder00-20
"MSI MPG GUNGNIR 110R WHITE Mid-Tower PC Case - M-ATX & Mini-ITX Capacity, 4 x 120mm ARGB fans with Hub Controller, Magnetic Dust Filter",157.63,MSI,MPGGUNGNIR110RWHITE,ATX Mid Tower,https://amazon.com/dp/B09NTNS59N?tag=pcbuilder00-20
Sharkoon Rev200 RGB PC Case Black Mid Tower,157.75,Sharkoon,Rev200 RGB,ATX Mid Tower,https://amazon.com/dp/B07ZVXPLZF?tag=pcbuilder00-20
DeepCool E-Shield Case Middle Tower Computer PC Desktop Gaming 0.6mm SPCC 3*USB3.0/2.0 with 120mm Fan 1*Bay 5.25'' Tempered Glass Side Panel (HxDxW: 477x438x210mm),158.07,DeepCool,E-SHIELD,ATX Mid Tower,https://amazon.com/dp/B07PM8YP5K?tag=pcbuilder00-20
"Phanteks Eclipse P500A Mid Tower Case, Black",158.3,Phanteks,PH-EC500ATG_BK01,ATX Mid Tower,https://amazon.com/dp/B088SZTN3Z?tag=pcbuilder00-20
"Thermaltake Divider 500 TG Air Black Color Mid Tower Computer Case with 1 120mm standard fan, 1 120mm rear fan, 2 mesh panel, 2 symmetrical triangular panels",158.39,Thermaltake,CA-1T4-00M1WN-02,ATX Mid Tower,https://amazon.com/dp/B09FP8ZXCV?tag=pcbuilder00-20
"NOX Hummer TGM Midi-Tower Black Computer Case (Midi-Tower, PC, SPCC, Black, ATX, Micro-ATX, Mini-ITX, Game)",159.42,NOX XTREME PRODUCTS,NXHUMMERTGM,ATX Mid Tower,https://amazon.com/dp/B07QVF4DCB?tag=pcbuilder00-20
"Thermaltake Core P3 Pro Snow E-ATX Tempered Glass Mid Tower Gaming Computer Chassis, Open Frame Panoramic Viewing",159.76,Thermaltake,Core P3 TG Pro Snow,ATX Mid Tower,https://amazon.com/dp/B0BDQKYQHS?tag=pcbuilder00-20
"Corsair CARBIDE 275R Mid-Tower Gaming Case, Tempered Glass",159.77,Corsair,CARBIDE 275R,ATX Mid Tower,https://amazon.com/dp/B079JV8ZB9?tag=pcbuilder00-20
"Geometric Future M8 Celluloid Mid Tower E-ATX/ATX Gaming Case, 4mm Glass/1.0 mm Steel, Vertical Air Tunnel Design, Support Type C, 420/360 Radiator, Vertical GPU Mount, GEO-M8-CEL (PC Case ONLY)",159.9,Geometric Future,Model 8,ATX Mid Tower,https://amazon.com/dp/B09SG8QRYZ?tag=pcbuilder00-20
ASUS TUF Gaming GT501 White Edition Mid-Tower Computer Case for up to EATX Motherboards,159.99,ASUS,90DC0013-B40000,ATX Mid Tower,https://amazon.com/dp/B08C7B6LWM?tag=pcbuilder00-20
ASUS TUF Gaming GT501 Mid-Tower Computer Case for up to EATX Motherboards with USB 3.0 Front Panel Cases GT501/GRY/WITH Handle,159.99,ASUS,90DC0012-B49000,ATX Mid Tower,https://amazon.com/dp/B07L6CHS16?tag=pcbuilder00-20
"Phanteks Eclipse G500A Mid Tower Case, DRGB, Black",159.99,Phanteks,PH-EC500GA_DBK01A,ATX Mid Tower,https://amazon.com/dp/B0BMPG47KQ?tag=pcbuilder00-20
Cooler Master HAF 500 High Airflow ATX Mid-Tower with Mesh Front Panel,160.43,Cooler Master,H500-KGNN-S00,ATX Mid Tower,https://amazon.com/dp/B09J5DSD5F?tag=pcbuilder00-20
Thermaltake H570 TG Black ATX Mid Tower ARGB Tempered Glass Computer Case Chassis with Mesh Front Panel CA-1T9-00M1WN-00,160.66,Thermaltake,CA-1T9-00M1WN-00,ATX Mid Tower,https://amazon.com/dp/B09WZMPZ4L?tag=pcbuilder00-20
be quiet! Computer Case,161.44,be quiet!,BG029,ATX Mid Tower,https://amazon.com/dp/B07HKT39FR?tag=pcbuilder00-20
Fractal Design Meshify 2 Black ATX Flexible Mid Tower Computer Case,164,Fractal Design,Meshify 2 Black,ATX Mid Tower,https://amazon.com/dp/B0822Y6H34?tag=pcbuilder00-20
Lian Li LANCOOL 215 RGB ATX Gaming Case,164.95,Lian Li,LANCOOL 215,ATX Mid Tower,https://amazon.com/dp/B08JM1M9YG?tag=pcbuilder00-20
Fractal Design Meshify 2 Black ATX Flexible Light Tinted Tempered Glass Window Mid Tower Computer Case,165.99,Fractal Design,Meshify 2,ATX Mid Tower,https://amazon.com/dp/B0822ZD9NP?tag=pcbuilder00-20
Fractal Design Torrent Compact RGB Black Computer Case TG Tempered Glass Light,167.08,Fractal Design,FD-C-TOR1C-02,ATX Mid Tower,https://amazon.com/dp/B08KTNHR27?tag=pcbuilder00-20
"be quiet! Silent Base 601 Window Silver Mid-Tower ATX Computer Case, two 140mm fans, 10mm extra thick insulation mats, PSU shroud",167.1,be quiet!,Silent Base 601,ATX Mid Tower,https://amazon.com/dp/B07GT3TB1N?tag=pcbuilder00-20
OBUDOWA GAMDIAS Argus M1,169.39,GAMDIAS,Argus M1,ATX Mid Tower,https://amazon.com/dp/B07ZD9J9WS?tag=pcbuilder00-20
be quiet! BG040 Silent Base 802 WhiteATX Case,169.9,be quiet!,BG040,ATX Mid Tower,https://amazon.com/dp/B08NW4LD54?tag=pcbuilder00-20
be quiet! BG039 Silent Base 802 Black ATX Case,169.9,be quiet!,Silent Base 802,ATX Mid Tower,https://amazon.com/dp/B08NW5741Z?tag=pcbuilder00-20
"Vetroo K1 Pangolin Mid-Tower ATX PC Gaming Case, Dual Tempered Glass, USB 3.0 I/O Panel High Airflow Computer Case Max 360mm Water Cooler Support (Fans are not Included)",169.99,Vetroo,K1,ATX Mid Tower,https://amazon.com/dp/B098DW1BNF?tag=pcbuilder00-20
Fractal Design Define 7 Gunmetal Brushed Aluminum/Steel E-ATX Silent Modular Mid Tower Computer Case,169.99,Fractal Design,Define 7,ATX Mid Tower,https://amazon.com/dp/B08147DC28?tag=pcbuilder00-20
Thermaltake View 37 Motherboard Sync ARGB E-ATX Mid Tower Gaming Computer Case with 3 ARGB 5V Motherboard Sync RGB Fans,169.99,Thermaltake,View 37,ATX Mid Tower,https://amazon.com/dp/B07JD431D5?tag=pcbuilder00-20
"Segotep T1 White Full-Tower E-ATX Gaming PC Case, Graphics Card Vertical Mounting, USB 3.0 Type-C I/O Panel, Cable Management/Optional 360mm Radiator",169.99,Segotep,CP-CASE-ST-ATX-T1-WT,ATX Mid Tower,https://amazon.com/dp/B09JB8CBLW?tag=pcbuilder00-20
"AORUS C300 Glass ATX Gaming Case, Tinted Tempered Glass, RGB Fusion 2.0, Upgraded I/O Panel with",169.99,Gigabyte,GB-AC300G,ATX Mid Tower,https://amazon.com/dp/B07QBQV85H?tag=pcbuilder00-20
"ASUS TUF Gaming GT502 ATX Mid-Tower Computer Case with Front Panel RGB Button, USB 3.2 Type-C and 2X USB 3.0 Ports",169.99,ASUS,GT502/BLK/TG//,ATX Mid Tower,https://amazon.com/dp/B0BQD5W3N9?tag=pcbuilder00-20
LIAN LI Lancool III Black Aluminum/SECC/Tempered Glass ATX Gaming Case with 4 ? 140 PWM Fans (Non-RGB) - LANCOOL 3-X,169.99,Lian Li,LANCOOL 3-X Black,ATX Mid Tower,https://amazon.com/dp/B0B46BGBBN?tag=pcbuilder00-20
Lian Li Lancool III RGB - mid Tower - Extended ATX,169.99,Lian Li,PC-LAN3RW,ATX Mid Tower,https://amazon.com/dp/B0B9WT5DKS?tag=pcbuilder00-20
LIAN LI LANCOOL 2 BLACK Tempered Glass ATX Case,171.12,Lian Li,Lancool2-X,ATX Mid Tower,https://amazon.com/dp/B081TRLCSG?tag=pcbuilder00-20
"Silverstone SST-PM01BR-W - Primera Midi Tower ATX Gaming Computer Case, Silent High Airflow Performance, with Window, Red LED, Black",171.26,SilverStone Technology,22201,ATX Mid Tower,https://amazon.com/dp/B01DXTH0JI?tag=pcbuilder00-20
Sharkoon REV100 Mid Tower PC Case 4044951030163,172.19,Sharkoon,4.04E+12,ATX Mid Tower,https://amazon.com/dp/B08GMZ6TLN?tag=pcbuilder00-20
Fractal Design Meshify 2 ATX Flexible Tempered Glass Window Mid Tower Computer Case,173,Fractal Design,Meshify 2,ATX Mid Tower,https://amazon.com/dp/B0822ZBCD8?tag=pcbuilder00-20
Fractal Design Torrent Compact Black Computer Case Solid,173.58,Fractal Design,FD-C-TOR1C-04,ATX Mid Tower,https://amazon.com/dp/B08KT8DGQL?tag=pcbuilder00-20
NZXT H510 Flow - CA-H52FW-01 - Compact ATX Mid-Tower PC Gaming Case - Perforated Front Panel - Tempered Glass Side Panel,174.41,NZXT,CA-H52FW-01,ATX Mid Tower,https://amazon.com/dp/B09CW354GD?tag=pcbuilder00-20
Corsair iCUE 5000X RGB Tempered Glass Mid-Tower ATX PC Smart Case,174.67,Corsair,iCUE 5000X,ATX Mid Tower,https://amazon.com/dp/B08M4B2KQ4?tag=pcbuilder00-20
be quiet! Shadow Base 800 FX - ARGB - 4 Light Wings 140mm PWM Fans - Mid-Tower PC Gaming Case - 420mm radiators or E-ATX motherboards Support - Black - BGW63,174.9,be quiet!,BGW63,ATX Mid Tower,https://amazon.com/dp/B0C592W24R?tag=pcbuilder00-20
"Lian-Li O11 Dynamic EVO ATX Mid Tower Tempered Glass Computer Case, White",174.99,Lian Li,O11DEW,ATX Mid Tower,https://amazon.com/dp/B09QMLS87T?tag=pcbuilder00-20
"MSI MPG GUNGNIR 111R Mid Tower Gaming PC Case - Black, 4 x 120mm ARGB Fans, USB 3.2 Gen2x2 Type-C",175.85,MSI,GUNGNIR 111R,ATX Mid Tower,https://amazon.com/dp/B09DPFKD9M?tag=pcbuilder00-20
Fractal Design Define 7 Black & White Brushed Aluminum/Steel E-ATX Silent Modular Tempered Glass Window Mid Tower Computer Case,175.99,Fractal Design,Define 7,ATX Mid Tower,https://amazon.com/dp/B08146X7B4?tag=pcbuilder00-20
ThermalTake Versa N26,175.99,Thermaltake,Versa N26,ATX Mid Tower,https://amazon.com/dp/B01ECFZ1X4?tag=pcbuilder00-20
Fractal Design Meshify 2  Black TG Light Tint - RGB,177.52,Fractal Design,FD-C-MES2A-06,ATX Mid Tower,https://amazon.com/dp/B08QZQQJDJ?tag=pcbuilder00-20
NZXT H710i - CA-H710 i-W1 - ATX Mid Tower PC Gaming Case - Front I/O USB Type-C Port - Quick-Release Tempered Glass Side Panel - Vertical GPU Mount - Integrated RGB Lighting,178.5,NZXT,H710i,ATX Mid Tower,https://amazon.com/dp/B07TD9Y6L7?tag=pcbuilder00-20
NZXT H710i ATX Mid Tower PC Gaming Case - Front I/O USB Type-C Port - Quick-Release Tempered Glass Side Panel - Vertical GPU Mount - Integrated RGB Lighting,178.5,NZXT,H710i,ATX Mid Tower,https://amazon.com/dp/B07T94WB77?tag=pcbuilder00-20
Thermaltake The Core P6 TG Black Edition transformable ATX Mid Tower Fully Modular Computer Case,179.7,Thermaltake,CA-1V2-00M1WN-00,ATX Mid Tower,https://amazon.com/dp/B09CVCWM7D?tag=pcbuilder00-20
Corsair WCORSAIR Carbide 200R Compact ATX Case,179.73,Corsair,Carbide 200R,ATX Mid Tower,https://amazon.com/dp/B009GXZ8MM?tag=pcbuilder00-20
"A ANIDEES AI Crystal Cube AR V3 Dual Chamber Tempered Glass EATX / ATX PC Gaming Computer Case, Water-Cooling Ready , Steel Structure, w/ 5 RGB PWM Fans / 2 LED Strips - Black AI-CL-Cube-AR3",179.9,A ANIDEES,Crystal Cube AR,ATX Mid Tower,https://amazon.com/dp/B07NWHCN69?tag=pcbuilder00-20
A ANIDEES AI Crystal Cube Mesh Front Panel AR V3 Dual Chamber Tempered Glass EATX / ATX PC Gaming Case w/ 5 RGB PWM Fans / 2 LED Strips - Black AI-CL-Cube-MAR3,179.9,A ANIDEES,AI Crystal Cube Mesh,ATX Mid Tower,https://amazon.com/dp/B07NWHFMXP?tag=pcbuilder00-20
"Phanteks (PH-EC600PSTG_BK01) Eclipse P600S Hybrid Silent and Performance ATX Chassis ??Tempered Glass, Black",179.99,Phanteks,PH-EC600PSTG_BK01,ATX Mid Tower,https://amazon.com/dp/B07N1N8R9N?tag=pcbuilder00-20
Segotep Phoenix ATX Black Mid Tower PC Gaming Computer Case USB 3.0 Type-C Ports/Graphics Card Vertical Mounting,179.99,Segotep,Phoenix ATX,ATX Mid Tower,https://amazon.com/dp/B07WNGN9X4?tag=pcbuilder00-20
"Segotep T1 Full-Tower E-ATX Gaming PC Case, Graphics Card Vertical Mounting w, USB 3.0 Type-C I/O, Cable Management/Optional 360mm Radiator",179.99,Segotep,Phoenix T1,ATX Mid Tower,https://amazon.com/dp/B08QHH4YMF?tag=pcbuilder00-20
Thermaltake Level 20 RS Motherboard Sync ARGB ATX Mid Tower Gaming Computer Case with 2 200mm ARGB 5V Motherboard Sync RGB Fans,179.99,Thermaltake,Level 20 RS,ATX Mid Tower,https://amazon.com/dp/B0837KQFCN?tag=pcbuilder00-20
Cooler Master MasterBox 540 ATX PC-Case with ARGB Front Panel,180.37,Cooler Master,MasterBox 540,ATX Mid Tower,https://amazon.com/dp/B08W1ZJT1K?tag=pcbuilder00-20
"MSI MPG Series SEKIRA 100R, Premium Mid-Tower Gaming PC Case: Tempered Glass Side Panel, Liquid Cooling Support up to 360mm Radiator",181,MSI,MPG Sekira 100R,ATX Mid Tower,https://amazon.com/dp/B08FF7DZY3?tag=pcbuilder00-20
"Corsair iCUE 220T RGB, Tempered Glass Mid-Tower ATX Smart Gaming Case",181.49,Corsair,iCUE 220T,ATX Mid Tower,https://amazon.com/dp/B0821SDWKL?tag=pcbuilder00-20
NZXT H710 - CA-H710B-W1 - ATX Mid Tower PC Gaming Case - Front I/O USB Type-C Port - Quick-Release Tempered Glass Side Panel - Cable Management System - Water-Cooling Ready,182.13,NZXT,H710,ATX Mid Tower,https://amazon.com/dp/B07T81N2H8?tag=pcbuilder00-20
"MSI MPG Series GUNGNIR 111M, Premium Mid-Tower Gaming PC Case: Tempered Glass Side Panel, RGB 120mm Fans, Liquid Cooling Support up to 360mm",185,MSI,MPG GUNGNIR 111M,ATX Mid Tower,https://amazon.com/dp/B08D2S2DVT?tag=pcbuilder00-20
"Cooler Master MasterBox Pro 5 RGB ATX Mid-Tower with Three 120mm RGB Fans, Front DarkMirror Panel, Tempered Glass, RGB Splitter",185.56,Cooler Master,MasterBox Pro 5,ATX Mid Tower,https://amazon.com/dp/B075N132C7?tag=pcbuilder00-20
"SilverStone Technology Grandia 11 Compact ATX Home Theater PC (HTPC) case with 240mm Radiator Support, SST-GD11B",186.77,SilverStone Technology,SST-GD11B,ATX Mid Tower,https://amazon.com/dp/B0B5GV42GH?tag=pcbuilder00-20
"MSI MAG VAMPIRIC 300R Mid-Tower PC Case - Tempered Glass, E-ATX Motherboard & Dual 360mm Radiator Capacity",189.13,MSI,306-7G19R21-809,ATX Mid Tower,https://amazon.com/dp/B0979Z327D?tag=pcbuilder00-20
AeroCool Boitier Moyen Tour ATX AeroCool Sentinel RGB avec panneau vitré,189.92,AeroCool,Boitier Moyen,ATX Mid Tower,https://amazon.com/dp/B07V5JGYFV?tag=pcbuilder00-20
"Phanteks Eclipse P600S Hybrid Silent and Performance ATX Chassis -Tempered Glass, Fabric Filter, Dual System Support",189.99,Phanteks,Eclipse P600S,ATX Mid Tower,https://amazon.com/dp/B07N1MBZ1W?tag=pcbuilder00-20
Fractal Design Meshify 2  White TG Clear Tint - RGB,189.99,Fractal Design,FD-C-MES2A-08,ATX Mid Tower,https://amazon.com/dp/B08QZRZFN4?tag=pcbuilder00-20
Phanteks Enthoo Evolv X ATX Mid Tower Case Tempered Glass Windows Digital RGB,193.1,Phanteks,Enthoo Evolv X,ATX Mid Tower,https://amazon.com/dp/B07GY29X6J?tag=pcbuilder00-20
"LIAN LI Mesh Airflow ATX PC Case Gaming Computer Case Mid-Tower Chassis with 3 ARGB PWM Fans Pre-Installed, Mesh Front Panel",195,Lian Li,LANCOOL 205 MESH RGB,ATX Mid Tower,https://amazon.com/dp/B09DYRVRMG?tag=pcbuilder00-20
"LIAN LI Mesh Airflow ATX PC Case Gaming Computer Case Mid-Tower Chassis with 3 ARGB PWM Fans Pre-Installed, Mesh Front Panel, Tempered Glass",195,Lian Li,LANCOOL 205 Mesh,ATX Mid Tower,https://amazon.com/dp/B093TNMQ9W?tag=pcbuilder00-20
"be quiet! Dark Base 700, Midi Tower ATX, 2 Pre-Installed Fans, RGB LEDs, Tempered Glass Window",195.41,be quiet!,Dark Base 700,ATX Mid Tower,https://amazon.com/dp/B0773NWQNQ?tag=pcbuilder00-20
Corsair Crystal Series 680X RGB High Airflow Tempered Glass ATX Smart Case,196.8,Corsair,Crystal 680X,ATX Mid Tower,https://amazon.com/dp/B07MSQ63WS?tag=pcbuilder00-20
"be quiet! Silent Base 601 Orange Mid-Tower ATX Computer Case, two 140mm fans, 10mm extra thick insulation",196.99,be quiet!,Silent Base 601,ATX Mid Tower,https://amazon.com/dp/B07GT3PRNL?tag=pcbuilder00-20
NZXT H710 ATX Mid Tower PC Gaming Case - Front I/O USB Type-C Port - Quick-Release Tempered Glass Side Panel - Cable Management System - Water-Cooling Ready,198.46,NZXT,H710,ATX Mid Tower,https://amazon.com/dp/B07TD9V22K?tag=pcbuilder00-20
"be quiet! Silent Base 802 Window White, Mid-Tower ATX, 3 pre-Installed Pure Wings 2 Fans, Sound Insulation, Tempered Glass Window",198.58,be quiet!,Silent Base 802,ATX Mid Tower,https://amazon.com/dp/B08NW2P9Z5?tag=pcbuilder00-20
be quiet! Silent Base 802 Black Window ATX Case,198.58,be quiet!,Silent Base 802,ATX Mid Tower,https://amazon.com/dp/B08NW4MK1X?tag=pcbuilder00-20
"HYTE Y60 Modern Aesthetic Dual Chamber Panoramic Tempered Glass Mid-Tower ATX Computer Gaming Case with PCIE 4.0 Riser Cable Included, Snow White (CS-HYTE-Y60-WW)",199,HYTE,CS-HYTE-Y60-WW,ATX Mid Tower,https://amazon.com/dp/B0BVJ4ZFPZ?tag=pcbuilder00-20
"iBUYPOWER Snowblind S 19"" Translucent Customizable Side-Panel LCD Display 1280 x 1024 Resolution, White",199,iBUYPOWER,SNOWBLIND S CASE,ATX Mid Tower,https://amazon.com/dp/B08413J5QG?tag=pcbuilder00-20
Fractal Design Define 7 Gunmetal Brushed Aluminum/Steel E-ATX Silent Modular Tempered Glass Window Mid Tower Computer Case,199.72,Fractal Design,Define 7,ATX Mid Tower,https://amazon.com/dp/B08146VT7V?tag=pcbuilder00-20
"Cooler Master MasterCase H500M ARGB Airflow ATX Mid-Tower with  Quad Tempered Glass Panels, Dual 200mm ARGB Fans, Type-C I/O Panel,  Vertical GPU Slots & ARGB Lighting System",199.99,Cooler Master,MasterCase H500M,ATX Mid Tower,https://amazon.com/dp/B07DF2SP3X?tag=pcbuilder00-20
"Thermaltake Core P90 Tempered Glass Black ATX Mid Tower Open Frame 2-Sided Glass Viewing, Tt LCS Certified Gaming Computer",199.99,Thermaltake,Core P90,ATX Mid Tower,https://amazon.com/dp/B078TMMJY8?tag=pcbuilder00-20
Thermaltake The Core P6 TG Snow Edition transformable ATX Mid Tower Fully Modular Computer Case with Tt LCS Certification CA-1V2-00M6WN-00,199.99,Thermaltake,CA-1V2-00M6WN-00,ATX Mid Tower,https://amazon.com/dp/B09CVWQJCR?tag=pcbuilder00-20
"HYTE Y60 Modern Aesthetic Dual Chamber Panoramic Tempered Glass Mid-Tower ATX Computer Gaming Case with PCIE 4.0 Riser Cable Included, Red (CS-HYTE-Y60-BR)",199.99,HYTE,CS-HYTE-Y60-BR,ATX Mid Tower,https://amazon.com/dp/B0BGVWX5H8?tag=pcbuilder00-20
HYTE Y60 Modern Aesthetic Dual Chamber Panoramic Tempered Glass Mid-Tower ATX Computer Gaming Case with PCIE 4.0 Riser Cable Included,199.99,HYTE,CS-HYTE-Y60-BW,ATX Mid Tower,https://amazon.com/dp/B09TPZ5R6B?tag=pcbuilder00-20
HYTE Y60 Modern Aesthetic Dual Chamber Panoramic Tempered Glass Mid-Tower ATX Computer Gaming Case with PCIE 4.0 Riser Cable Included,199.99,HYTE,CS-HYTE-Y60-B,ATX Mid Tower,https://amazon.com/dp/B09TQ1J58V?tag=pcbuilder00-20
"Razer Tomahawk ATX Mid-Tower Gaming Case: Dual-Sided Tempered Glass Swivel Doors, Ventilated Top Panel, Chroma RGB Underglow Lighting, Built-in Cable Management, Classic Black",199.99,Razer,RC21-01420100-R3M1,ATX Mid Tower,https://amazon.com/dp/B08G3LXFV6?tag=pcbuilder00-20
Fractal Design Torrent White E-ATX Tempered Glass Window High-Airflow Mid Tower Computer Case,199.99,Fractal Design,FD-C-TOR1A-03,ATX Mid Tower,https://amazon.com/dp/B099X5M4FQ?tag=pcbuilder00-20
Thermaltake Core P5 Tempered Glass Titanium Edition ATX Vertical GPU Modular Gaming Open Frame Computer Case CA-1E7-00M9WN-00,199.99,Thermaltake,CA-1E7-00M9WN-00,ATX Mid Tower,https://amazon.com/dp/B07DVQC4KB?tag=pcbuilder00-20
"Thermaltake Divider 500 TG White Edition ARGB ATX, Computer Case with 3 120mm 5V ARGB Front Fans + 1 120mm Standard Rear Fan + 2 Symmetrical Triangular Panels",199.99,Thermaltake,CA-1T4-00M6WN-01,ATX Mid Tower,https://amazon.com/dp/B09FPCXCXC?tag=pcbuilder00-20
"Thermaltake Divider 500 TG Black Color ARGB ATX Mid, Computer Case with 3 120mm 5V ARGB Front Fans + 1 120mm Standard Rear Fan + 2 Symmetrical Triangular Panels",199.99,Thermaltake,CA-1T4-00M1WN-01,ATX Mid Tower,https://amazon.com/dp/B09FP5WWSV?tag=pcbuilder00-20
Corsair iCUE 4000D RGB Airflow Mid-Tower Case - 3X AF120 RGB Elite Fans - iCUE Lighting Node PRO Controller,200.17,Corsair,iCUE 4000D RGB AIRFLOW,ATX Mid Tower,https://amazon.com/dp/B0BKBV7QMM?tag=pcbuilder00-20
"Phanteks Eclipse P600S (PH-EC600PSC_BK01) Hybrid Silent and Performance ATX Chassis - Fabric Filter, Dual System Support, PWM hub",203.23,Phanteks,Eclipse P600S,ATX Mid Tower,https://amazon.com/dp/B07N1MS2JV?tag=pcbuilder00-20
Fractal Design Torrent Black E-ATX Tempered Glass Window High-Airflow Mid Tower Computer Case,204.12,Fractal Design,FD-C-TOR1A-01,ATX Mid Tower,https://amazon.com/dp/B099X7C238?tag=pcbuilder00-20
COUGAR Blazer Essence Open-Frame Premium Gaming Mid Tower,204.12,COUGAR,CGR-5LMHO,ATX Mid Tower,https://amazon.com/dp/B08C27JWL7?tag=pcbuilder00-20
"Phanteks Eclipse G500A Mid Tower Case, DRGB, Matte White",205.86,Phanteks,PH-EC500GA_DMW01A,ATX Mid Tower,https://amazon.com/dp/B0BMPD1CVP?tag=pcbuilder00-20
"CORSAIR Carbide SPEC-Omega RGB Mid-Tower Gaming Case, 2 RGB Fans, Lighting Node PRO Included, Tempered Glass",207.34,Corsair,Carbide SPEC-Omega,ATX Mid Tower,https://amazon.com/dp/B07B2YJXLM?tag=pcbuilder00-20
Fractal Design Define 7 Black Brushed Aluminum/Steel E-ATX Silent Modular Dark Tempered Glass Window Mid Tower Computer Case,207.98,Fractal Design,Define 7 Black,ATX Mid Tower,https://amazon.com/dp/B08146X79Y?tag=pcbuilder00-20
"Fractal Design Define 7 White Brushed Aluminum/Steel E-ATX Silent Modular Tempered Glass Window Mid Tower Computer Case, White TG Clear Tint",207.98,Fractal Design,Define 7,ATX Mid Tower,https://amazon.com/dp/B08146VVWT?tag=pcbuilder00-20
Fractal Design Torrent Gray TG Light Tint,208.86,Fractal Design,FD-C-TOR1A-02,ATX Mid Tower,https://amazon.com/dp/B08698DZ25?tag=pcbuilder00-20
"Cooler Master MasterCase H500P Mesh ARGB - PC Case with Dual 200mm Fans for High-Volume Airflow, Builder-Focused Chassis Panels",209.99,Cooler Master,MasterCase H500P,ATX Mid Tower,https://amazon.com/dp/B084DPT3N2?tag=pcbuilder00-20
"Cooler Master MasterBox K500 ATX Mid Tower with Dual 120mm RGB Fans, Front Semi-Meshed Ventilation, Front RGB Strips, Tempered Glass",212,Cooler Master,MasterBox K500,ATX Mid Tower,https://amazon.com/dp/B07B5XNBQN?tag=pcbuilder00-20
Corsair iCUE 5000D RGB Airflow Mid-Tower Case - 3X AF120 RGB Elite Fans - iCUE Lighting Node PRO Controller - High-Airflow Design - CORSAIR RapidRoute Cable Management System - Black,213.99,Corsair,CC-9011242-WW,ATX Mid Tower,https://amazon.com/dp/B0BKC67D3V?tag=pcbuilder00-20
NZXT H7 Elite - CM-H71EB-01 - ATX Mid Tower PC Gaming Case - Front I/O USB Type-C Port - Quick-Release Tempered Glass Side Panel - Black,214.78,NZXT,CM-H71EB-01,ATX Mid Tower,https://amazon.com/dp/B09VNZHL44?tag=pcbuilder00-20
MUSETEX ATX PC Case Pre-Install 4 PWM ARGB Fans Bundled with 1000W Full Modular ATX Power Supply (K2 - MU1000),214.98,MUSETEX,K2-MU1000,ATX Mid Tower,https://amazon.com/dp/B0CM37C5Y1?tag=pcbuilder00-20
Corsair iCUE 5000X RGB Tempered Glass Mid-Tower ATX PC Smart Case - White,214.99,Corsair,iCUE 5000X RGB,ATX Mid Tower,https://amazon.com/dp/B08M4BN431?tag=pcbuilder00-20
